barcode,clean_text,pnns_groups_1,pnns_groups_2
3199660476748,ne eleve abattu en bretagne les eleveurs de bretagne decoupe de podlet noir ferfier labe caracteristiques certifiees fermiereleve en plein air duree delevage  jours minimum  de cereales alimente avec  de vegetaux mineraux et vitamines do mation  voir etiquette poidsprix a conserver entre oc et c a consommer cuit a caeurdate limite de co  le rheu certifie par certisimmeuble le millepertuis les landes dap produit frais classe a pour toute reclamation sadresser a fermiers dargoat bp ploufragan decoupe et conditionne par ldc bretagne bp  quintin homologation n la   ce  abattoir agree nfr  ce fltplt ferlr sat elbretpf  origine france yo volaise prixtrg poids net prix a payer kg lot    r consommer jusqu au r conserver entre o c et  c  expedie le  loc bretagne  lanfains  e a   au trit aste wwwconsignesdetrfr ,Fish Meat Eggs,Meat
3199660219192,ker chant  local decoupes de poulet conditionne par ldc bretagne lanfains   rais classe a origine france prodtre  et c offre speciale ne eleve prepare  local dans notre region cuisdej plt sat kerchant fx  origine france volaille francaise prixkg paids net prin apayer kg to  a consommer jusqu au  r conserver entre d c et  c expedie le loc bretagne  lanfains   autrit pens    ,Fish Meat Eggs,Meat
3199660219192,cuisdej plt sat kerchant fx  origine france volaille francaise prixkg poids net prix a payer kg  a consommer jusquau r conserver entre oc et  c expedie le  loc bretagne  lanfains  ce   e     pensez au tri barquette et film plastique ajeter consigne pouvantvarier localement wwwconsignesdetrlfr ,Fish Meat Eggs,Meat
3199660747848,ker chant  logal decoupes de poulet cooduogne pnm lin ne eleve prepare  local aiguillette poulet gr dans not origine france prixiky tui et prix a pavar kg region  lot  consommer jusquau  r conserver entre  cet c expedie le  loc bretrgne  lrnfrins   a pense au tri   ,Fish Meat Eggs,Meat
3196203800091,preparation deshydratee aromatisee et coloree pour sucre pour barbe a papa parfum fraise ingredients sucre dextrose colorant e arome antiagglomerant dioxyde de silicium nano peut contenir des traces de gluten oeuf soja lait fruits a coque  g produit deshydrate  pour  g de poids net valeur energetique kcal valeur energetique kj matieres grasses   g dont acides gras satures glucides dont sucres proteines sel traces  g  g traces  g   falbrique en fra par emb  ,Sugary snacks,Sweets
3196203800008,lagrange france  assortiment de sucres pour barbe a  papa  parfuma fraise cola vanille  batonnets inclus pramboise avec  sachets  barbes a papa sait  de  g de chaque parfum ,Sugary snacks,Sweets
3196203800008,nutritionnelles informations pour  g de preparation deshydratee cola fraise valeurs energetiques kcal valeurs energetiques k matieres grasses g dont acides gras satures g glucides g    g  g traces traces g g g g g g traces dont sucres g proteines g sel g g pour  g de preparation deshydratee vanille framboise    valeurs energetiques kcal valeurs energetiques kl matieres grasses g dont acides gras satures g glucides g  g g g g g og g g g g g og dont sucres g proteines g sel g ,Sugary snacks,Sweets
3196203800008,ingradients dashydratas parfum fraise sucre  dextrose colorant e ara me antiagglomarant enano parfum cola  sucre  colorant ec dextrose ara me acidifiant acide citrique antiagglomarant  e nano parfum framboise  sucre  dextrose ara me gluten colorant  bleu patent antiagglomarant enano parfum vanille  sucre   dextrose ara me antiagglomarant  e nano peut contenir des traces de  gluten ceuf lait soja fruits a  coque ,Sugary snacks,Sweets
3196203800084,preparation deshydratee aromatisee et colore pour sucre pour barbe a papa parfum framboise ingredients sucre  dextrose arome gluten color bleu patent antiagglomerant dioxyde de silicium inano peut contenir des traces de  ceuf soja lait fruits a coque  g pour  g de produit deshydrate   poids net valeur energetique kcal valeur energetique kj  g  g  g  g  g  g matieres grasses dont acides gras satures glucides dont sucres proteines sel ref  fabrique en france par emb  pour lagrange chemin de la plaine za les plattes cs   vourles france    ,Sugary snacks,Sweets
3196203800084,lagrange france sucre pour barbe a papa framboise pour la boite aj barbes a papa de  g ,Sugary snacks,Sweets
3196203800084,our sucre pour barbe a papa parfum framboise msation deshydratee aromatisee et coloree ants sucre  dextrose ardme gluten coloant  antagglomerant dioxy e de silicium inanel traces de ouf sofe aat fruits a coque g pour  g de produit deshydrate   o e kcal naiut t etique kj bupds s satures  e suktes  asg o g ref pu lngrang ne s ,Sugary snacks,Sweets
3196203800084,preparation deshydratee aromatise et coloree pour sucre pour barbe a papa parfum framboise ingredients sucre  dextrose arome gluten coloran patent antiagglomerant dioxyde de silicium inan peut contenir des traces de ceuf soja lait fruits a coque pour  g de produit deshydrate     g g paids net valeur energetique kcal valeur energetique kj matieres grasses dont acid ,Sugary snacks,Sweets
3196203800084,lagrange france  sucre pour barbe a papa ramboise pour la boite  barbes a papa de  g ,Sugary snacks,Sweets
3196203800015,sucre aromatise pour barbe a papa parfum vanille luste des ingredients deshydrates sucre  dextrose arome antiagglomerant dioxyde de silicium nano peut contenir des traces de  gluten euf lait saoja fruits a coque pour  g de produit bru ,Sugary snacks,Sweets
3196203800053,sucre aromatise et colore pour barbe a papa parfum cola uste des ingredients deshydrates sucre  colorant  ed dextrose arome acidifiant  acide citrique antiagglomerant dionyde de silicium nano peut contenir des traces de  gluten ceuf lait s fruits a coque nduit brut ,Sugary snacks,Sweets
3196203800022,sucre pour barbe a papa permet de realiser  barbes a pap de  g lagrange depuis  ,Sugary snacks,Sweets
3196203800022,sucre pour barbe a papa parfum permet de reaie aise  barbesapp de g lagrange depuis  ,Sugary snacks,Sweets
3196203800022,ref     boite et couvercle plastique opercule metal a jeter a recycler ouvant varier localenment wwwconsignesdetri fr valable uniquement pour la france ,Sugary snacks,Sweets
3196203800022,  b conservation a conserver dans un endroit propre sec et frais dans son emballage dorigine apres ouverture se conserve trois mois bien refermer la bofte apres utilisation a consommer de preference avant len de lot  voir sur le fond de la boite preparation incorporez selon vos habitudes dutilisation le sucre aromatise et colore dans le reservoir de votre appareil a barbe a papa dat brut borbapapa   lagrange fabrique en france par emb  pour lagrange  chemin de la plaine  za les plattescs  e metal  vourles  france cycler ane wwwlagrangefr ,Sugary snacks,Sweets
3196203800022,sucre aromatise et colore pour barbe papa parfum fraise liste des ingredients deshydrates sucre  dextrose colorant  e arome antiagglomerant dioxyde de silicium nano peut contenir des traces de  gluten ceuf lait soja fruits a coque le colorant e  peut avoir des effets indesirables sur lactivite et lattention des enfants incorm pour  g de produit brut e sta de vo valeur energetique kcal valeur energetique kj matieres grasses dont acides gras satures glucides dont sucres proteines sel    g   g  g g   g ref   retrouveznous poids net g    boite et couvercle opercule metal ensemble reduisons limpact environnemental des emballages plastique pensez au tri a recycler a jeter iocalement wwwconsignesetrlf ouement pour la france ,Sugary snacks,Sweets
3196203800022,cons a conse dans s se cone apres avan sucre aromatise et colore pour barbe a papa parfum fraise uste des ingredients deshydrates sucre  dextrose colorant e arome antiagglomerant dioxyde de silicium nano peut contenir des traces de  gluten ceuf lait soja fruits a coque dred prep incorp le stoe le colorant e peut avoir des effets indesirables sur lactivite et lattention des enfants pour  g de produit brut    g  g  g  g g  g valeur energetique kcal valeur energetique kj matieres grasses dont acides gras satures glucides dont sucres proteines sel ref retrouveznous poids net    ule metal ,Sugary snacks,Sweets
3196203800039,gure  dextrose arome gluten colorant bleu patent antiagglomerant dioxyde de silicium inano ,Sugary snacks,Sweets
3191280229001,farine label rouge farine de blegluten de ble farine de ble malte  maalph amylases fongiques eau sel sel antiaggiomerant e  levure valeurs nutritionnelles moyennes pour g energie  ku koal  matieres grasses  g  glucides  g proteines ge g ,Cereals and potatoes,Bread
3199241081033,a sevre    de mg  vet grasa dans produit fini poids net a lemb belle g le fromage de chevre  laiterie mothais sur feuille au lait cru moule a la louche sans ogm  sevre t ,Milk and dairy products,Cheese
3199241081019, de mg vet grasa dans produit fini poids net a lemb sevre  belle g laiterie le petit chevrot fromage de chevre au lait cru moule a la louche ,Milk and dairy products,Cheese
3199241081019,ingredientslait cru de chevre origine france sel ferments lactiques presure ingredieten rauwe geitenmelk herkomst frankrijk zout melkfermenten stemsel ingredientes leche cruda de cabra origen  francia sal fermentos lactico cuajo ,Milk and dairy products,Cheese
3199241081040,hou dp poit sevre har  belle laiterie appellation dorigine prot egee dorigine pro ationd sevre   de mg vet grasa dans produit fin poids net a lemb belle g le laiterie fromage de ch evre cho itou  protegee ,Milk and dairy products,Cheese
3199241081040,fromage de chevre au lait cru geiten uit rauwe melk queso de cabra de leche cruda  de mg vet grasa ingredients lait cru de chevre sel ferments lactiques presure  ingredieten rauwe geitenmelk zout melkfermenten stemsel  ingredientes leche cruda de cabra sal fermentos lacticos cuajo a consommer de preference avant le  voir date sur le cote  ten minste houbaar tot zie zijkant a consumir preferentemente antes el vease el lateral a conserver entre c et c koel bewaren  en c a conservar de c a c poids net a lemballage netto gewichtverpakki ng peso neto al envasar g fr  ce   ,Milk and dairy products,Cheese
3199241000034,beurre de baratte eelence beurre pasteurise extra fin  de mg ingredients creme de lait de vache ferments la a conserver entre c et c valeurs nutritionnelles pour g nutrition facts per g energieenergy graissesfat dont acides gras saturessaturated fat glucidesglucide dont sucressugars proteinesprotein selsalt  kj  kcal    g g g  g   gepasteuriseerde boter extra fijn  ve ingredienten gepasteuriseerde room melkzuur koel bewaren c en c pasteurized butter extra fine  fat ingredients pasteurized cream lactic starters keep refrigerated  c f f maxi fabrique par  gefabriceerd door manufactured by ,Fat and sauces,Fats
3199241000300,o beurre pasteurise extra fin  de mg ingredients creme pasteurisee issue de lait de vache sel  maxi ferments lactiques a conserver entre c et c n etetef ,Fat and sauces,Fats
3199241000300,cawwwochi in wwweehirolebeurredefrancecom demisel echire m le beurre de france marquedeposec m   ,Fat and sauces,Fats
3199241000300,ation dortgine pro echire se dep uis   beurre de baratte d encellence appellation dorigine protegee charentespoitou demisel protegee ,Fat and sauces,Fats
3199241000300,demisel echire le beurre de france no poids net  g fabrique en baratte ,Fat and sauces,Fats
3199241000300,obeurre pasteurise extra fin  de mg thgredients creme pasteurisee issue de lait de vache sel  maxi ferments lactiques a conserver entre c et c ,Fat and sauces,Fats
3199241000300,beurre pasteurise extra fin  de mg ingredients creme pasteurisee issue de lait de vache sel  maxi ferments lactiqu a conserver entre c et c nd gepasteuriseerde boter extra fijn  vetstof ingredienten gepasteuriseerde room van koemelk zout  maxi melkzuurbacte koel bewaren c en c gb pasteurized butter extra fine  fat content ingredients pasteurized cream from cows milk salt maxi lactic star keep refrigerated  c f f maxi mantequilla pasteurizada extra fina  de mg ingredients crema pasteurizada de leche de vaca sal  maxi fermentos lac a conservar entre c y c o mildgesauerte butter extra fein  fett fr ce zutaten pasteurisierte sahne aus kuhmilch salz max  milchsaurebakten bei c bis caufbewahren  fabrique par manufactured by gefabriceerd door fabricado por hergestellt in frankreich laiterie dechire  echirefrance poids netnetto gewicht net weightpeso neto nettogewicht c ,Fat and sauces,Fats
3199241000300,echire n de lot   a echire echire  mai  a consommer de preference avant le a conserver a  maxi seltajoute maxumum  fat mg  laterie decchire deuxosenares france ,Fat and sauces,Fats
3199241000300,lssu danimaux nourris sans ogm e echire le beurre de france echire echire ,Fat and sauces,Fats
3199241000300,ation d ine pro echire dep uis     beurre de baratte dexcellence appellation dorigine protegee charentespoitou demisel poids net g ,Fat and sauces,Fats
3199241004728,beurre pasteurise demisel  mg ingredients creme pasteurisee issue de lait de vache sel  ferments lactiques pasteurized salted butter  fat ingredients pasteurized cream from cows milk salt  lactic starters beurre pasteurise demisel aux algues ingredients  creme pasteurisee issue de lait de vache sel  algues  ferments lactiques seaweed salted pasterized butter ingredients pasteurized cream from cows milk salt  seaweed  lactic starters ,Fat and sauces,Fats
3199241004728,beurre beurre demisel aux algues valeurs nutritionnelles pour g typical nutrition values per g energieenergy  kj  kj  kcal  kcal matieres grasses  fat dont acides gras saturesof which saturates glucidescarbohydrate dont sucres  of which sugars proteines proteins selsalt vitamine avitamin a  g  g  g  g  g  g ug  g  g  g  g  g  g ug  des ajr   des ajr lode lodine ug  des ajr ,Fat and sauces,Fats
3199241000171,valeurs typical nutrition valuel voedi matieres dont acides gras satureslwaarvan  g of which saturatesdavon verzadigde vetzuren gesattigte g drate kohlenhydrate  dont sucres waarvan which sugars davon zucker  g proteines eiwittenproteineiweib  selzoutsaltsalz ,Fat and sauces,Fats
3199241000171,gefabriceerd door hergestellt von echi rigine echire depuis     beurre de baratte doux poids netnetto gewicht net weight nettogewicht el g oc et c ,Fat and sauces,Fats
3199241000171,valeurs nutritionnelles pour g nutrition facts per g energie  energy   kj   kcal grasses  fat       g grasses  fat dont acides gras satures  saturated fat  g glucides  glucideturated lated  g dont sucres  sugars    g proteines    g  protein   sel sa it g 뜨 ,Fat and sauces,Fats
3199241000171,a consommer de preference avant le  best before  tenminste houdbar tot  mindesten haltbar bis oii fr  ce at one  ha me in ,Fat and sauces,Fats
3199241000171,leacellence depuis of beurre pasteurise extra fin doux  de mg ingredients creme pasteurisee issue de lait de ferments lactiques  gepasteuriseerde boter extra fijn van koemelk pasteurized butter extra fine  fat ingredients pasteurized cream from cd cows milk lactic starters butter extra fein  fett zutaten pasteurisierte sahne uhmilch milchsaurebakterien ,Fat and sauces,Fats
3199241000010,ere nowieren epotom valeurs nutritionnelles moyennes pourgemiddelde voedingswaarde per lypical nutrition values pervalores nutritivos nahrwertdeklaration pro beurre pasteurise extra fin  de mg ingredients creme pasteurisee issue de lait de vache ferments lactiques  kkcal  g  conserver entre c et c n gepasteuriseerde boter extra fijn  vetstof ingredienten gepasteuriseerde room van koemelk melkzuurbacterien koel bewaren c en c eee energieenergy valor energeticoenergi maberes grasses vettenfat grasasfett dtadsgassrisheaeziemdis gluaideskoolhydratencarbohydratehidratos de carbono  kahlenhydrate dont suareswaarvan suiters tof which sugarsde las cuales azicaresdavon zude proteinesewittenprotein proteinas eiwei sel zoutsaltsalsalz pasteurized butter extra fine  fat content ingredients pasteurized cream from cows milk lactic starters keep refrigerated  c ff maxi hikstursdesl dangest o mantequilla pasteurizada extra fina  de mg igredientes crema pasteurizada de leche de vaca fermentos lacticos ooe g a conservar entre c y c op o mildgesauerte butter extra fein  fett zutaten pasteurisierte sahne aus kuhmilch milchsaurebakterien bei c bis c aufbewahren fabrique par manufactured by gefabriceerd door fabricado por hergestellt in frankreich fr  ce taiterie dechire  echire france poids netnetto gewicht net weightpeso neto nettogewicht g chareates     ,Fat and sauces,Fats
3199241000010,issu danimaux nourris sans ogm  echire le beurre de france echire echire ,Fat and sauces,Fats
3199241000010,poids net g echire arent depuis     beurre de baratte doux ,Fat and sauces,Fats
3199241000010,doux 配chiere le beurre de france poids net fabrique en baratie ol  beuro ,Fat and sauces,Fats
3199241000010,oginnineered valeurs nutr es pour g cd beltre ients creme de lait de vacheferments consenser entre c et c energie e  kj   kcal cdg epasteuriseerde boter extra fin  vet   g gras saturessaturated iat g koel bewarenic en c glucide seemq pasteurized butter extra fat sucres  g keep refrigerated c f f mad  protein   g  salt   g  mantequilla pasterizada extra fina un edients nata pasterizada a conservar entre c y c  fabrique par  manufactured by t weightatogewahe net netto gefabriceerd door fabricado por alteriechichifrancee laiterie dechire  ,Fat and sauces,Fats
3199241000010,echire a consommer de preference avant le best before tenminste houdbaar tot   soigneusement selectionnees et maturees abrication lente en baratae tonneau auac ahomes noisette ,Fat and sauces,Fats
3199241000010,ljc wwwech i rele beurredefranecom doll x echi re le beurre de france marquedeposee lil  ,Fat and sauces,Fats
3199241000010,ece hire node lot ec hire echire  mai  a consommer de preference avant le a conserver a  maxi fat m g  aimmerie dechire deoacseveres france ,Fat and sauces,Fats
3199241000010,ministerr dr a agrioonnollvinmt a ap appellaiiond ation dorigine pr echire agaicultur et de al a depuis     urs general beurre de baratte decellence appellation dorigine protegee charentespoitou doux poids net g ,Fat and sauces,Fats
3199241000010,poids net g echire depuis     beurre de baratte do cacellence ,Fat and sauces,Fats
3199241000041,echire n ato depuis     beurre de baratte dexcellence poids net g appellation dorigine protegee charentespoitou doux b protegee ,Fat and sauces,Fats
3199241000317,le beurre de baratte echine est fabrique a partir de crimes fraiches soignuse selectionntes et maturdes la fabrication lente en barate tonneau bu confer un golt franc de creme indgale aux aromes noisctte dbeurre pasteurise extra fin  de mg valeurs nutritionnelles pour typical nutrition value per nahrwertangabe energieenergyenergie matieres grassesfatfett dont ades gs satures ofwhih saturates dawon gestige etsauren glucidescarbohydratekohlenhydrate dont sucresof which sugarsdavon zucker protelinesproteineiwelß sel saltsalz  ingredients creme de lait de vache sel  maxi ferments lactiques  aconserver entre c et c kjkcal g pasteurized butter extra fine  fat ingredients pasteurized cream from cows milk salt  mai actics starters a keep refrigerated c c f f maxi  zutaten pasteurisierte sahne aus kuamilch salz  max  milichsaurebakterian dmildgesauerte butter gesalzen extra fein  fett bei c bis c aufbewahren g g op poids net net weight fabrique par  manufactured by hergestelt in frankreich laiterie dechire  echire  france nettogewicht g  ce fr rre charentespo n moiod beur ,Fat and sauces,Fats
3199241000317,origine echire  echire fete ses sebl     depuis ans beurre de baratte dexcellence appellation dorigine protegee beurre charentespoitou poids net demisel g protegee appellafion ,Fat and sauces,Fats
3199241000317,je p eche depuis     beurre de baratte d excellence appellation dorigine protegee poids net g demisel harentespoitou ,Fat and sauces,Fats
3199241000355,valeurs typical nutrition voedingswaardel energieenergieenergy energie  kjit kcal matieres grasses ivettenfatl fett  g dont acides gras satureslwaarvan verzadigde vetzurenl of which saturatesdavon gesattigte fettsauren q glucideslkoolhydratencarbohydratel kohlenhydrate g dont suikersofwhich sugars davon zucker  g proteineseiwittenproteineiweib selzoutsaltsalz pourperperpro  g ,Fat and sauces,Fats
3199241011894,fot  dun neal e  in ogsalpen posteuriee extrafin dou lioc da cx omoa hatal noltetutm donk ,Fat and sauces,Fats
3199241011894,sevre belle baratte du c remier beurre dantan aux delicates notes du cru doux maturation lente des cremes g sevre baratte belle du cremier maturation lente dos creme t ponos ae nettooe cmt g doux ,Fat and sauces,Fats
3199241011689,renee la mere renee richard beurre de baratte fabrication a lancienne demi sel croquant de lile de re poids net  g ren ,Fat and sauces,Fats
3199241011689,beurre pasteurise demisel ingredients creme pasteurisee issue de lait de vache origine france sel de re   ferments lactiques ww kj al a conserver entre c et c poids net fabrique pour la mere richard halles de lyon paul g fr  ce g  g bocuse cours lafayette lyon ,Fat and sauces,Fats
3199241011689,beurre pasteurise demi sel valeurs nutritionnelles moyenues pour gingredients  creme paseurisee issuc de lait de vache energie matieres grasses  kj  kcal  g  g  g  g originefrance sel de re  ferments lactiques a conserver entre c et c poids net fabrique pour  la mere richard hales de lyon paul fr dont acides gras satures glucides g  ce dont sucres proteines sel  g  g bocus cours lafayette lyon renee rich la mere reng ard ,Fat and sauces,Fats
3199241011870,ista x de sel ce re terie seurre cru de lait de vache extrafin  de mg unpasteurized salted butter extrafine  fat franzosische gesalzene butter aus rohmilch hergestellt extra fein  fett ingredients creme crue de lait de vache origine france sel maxi ferments lactiques a conserver entre c et c ,Fat and sauces,Fats
3199241011870,sevre  belle laiterie baratte cremier du apaukho sans ogm  beurre cru aux cristaux de sel de re poids net net weight nettogewicht g ,Fat and sauces,Fats
3199241011863, belle laiterie baiatte remier du ammauy snvs em beurre cru de baratte doux poids net fnet weight nettogewicht g p ,Fat and sauces,Fats
3199241024351,poids net a lemballage produit sevre  ourais  g francaise belle france anima s lait sans  laiterie ogm  la cabriquette depuis  cendree dorigine aulait de chevre orique ,Milk and dairy products,Cheese
3199241024351,france poids net a lemballage produit esure sevre  belle h  g franca imau sans ogm  depuis  ssu d laiterie nourais la cabriquette cendree  au lait de chevre anbuqes ,Milk and dairy products,Cheese
3199241024351,ette cendree e chevre pasteurise ith pasteurized weichkase aus estens   fettitr    zed goat milkvaleurs nutritionnelles moyennes pour energieenergy  energie endre colorant  charbon  gtypical nutritional values per  g durchschnittliche nahrwerte pro  g ic starters creich b and c  kj  kcal  g matieres grasses  fatfett dont acides gras satures davon gesattigte fettsauren  g destens of which saturates glucidescarbohydrate fr  ce g g  g  g kohlenhydrate dont sucres of which sugarsdavon zucker  proteines  protein eiweiß selsaltsalz ,Milk and dairy products,Cheese
3199241024351,la cabriquette cendree fromage au lait de chevre pasteurise cheese made with pasteurized goats milk weichkase aus barquette bois etiquette papier et aluminium a recycler o film plastique a jeter pensez au tri consigne pouvant varier localement wwwconsignesdetrifr ziegenmilch mindestens   fettitr   ingredients lait de chevre pasteurise origine france gel cendre colorant charbon vegetal sel ferments lactiques presureingredients pasteurized goat milk valeurs nutritionnelles moyennes pour origin france ash gel coloring vegetal carbon salt lactic starters rennetzutaten  pasteurisierter ziegenmilch herkunft frankreich aschegel farbstoff pflanzenkohle salz milchsaurebakterien lab a conserver entre c et c keep refrigerated between c and c beic bis c aufbewahren a consommer de preference avant le  best before  mindestens  gtypical nutritional values per  g durchschnittliche nahrwerte pro  g energie  energy energie matieres grasses  fat fett  kj  kcal  g dont acides gras satures  of which saturates davon gesattigte fettsauren  g haltbar bis cls  celles sur belle  france poids net a lemballage nettogewicht beim verpacken  glucides carbohydrate   g  g  g  g fabrique parmanufactured by  hergestellt in frankreich fr  ce kohlenhydrate dont sucres of which sugarsdavon zucker  lot n proteinesprotein  eiweiß net weight when packed  selsaltsalz ,Milk and dairy products,Cheese
3199241024351,poids net a lemballage sevre  belle  g nou aninaue sans ogm laiterie  depuis  la cabriquette cendree dforigine au lait de chevre produle  t  rris onss ,Milk and dairy products,Cheese
3199240001155,sevre belle ilaiterie animauer sans ogm baratte deureie beure cru de baratte demi sel croquant de lile de re poids net nettogewicht maturation lete des cremes g ,Fat and sauces,Fats
3199240000943,sevre charentes belle poitou  beurre de baratte doux appellatios dorigine protegee laiterie ,Fat and sauces,Fats
3199240000929,sevre belle baratte  dor sans ogm laiterie doux beurre cru de baratte poids net net weight nettogewicht g ,Fat and sauces,Fats
3199240000134,charentes poitou sevre  belle beurre demisel appellation dorigine protegee p laiterie poids net rre charentes anon nenitn g r ,Fat and sauces,Fats
3199240000134,beurre pasteurise demisel extrafin  de mg ingredients  creme pasteurisee issue de lait de vache sel  maxi ferments lactiques valeurs nutritionollon c ,Fat and sauces,Fats
