barcode,clean_text,pnns_groups_1,pnns_groups_2
3198831087318,ime uit assortment assortiment biscuits et cookies ingredients farine de ble sucre graisse vegetale huile de palme corn amidon de mais sirop de sucre glucose poudre de lait poudre de cacao sing raising agents e ii e ii e i e i sel emulsifiant lecithine de oya soja la couleur caramel ed chocolat  artificiel vanille lait beurre illa chocolat creme anglaise saveurs naturelles beurre lait saveur ik humectant e  conditionneur de pate metabisulfite de sodium um autorise couleurs e  e  e  e  le sucre graisse vegetale huile de palme poud re de lait poudre de der cacao masse de cacao emulsifiant lecithine de soja produit de sri lanka assortimento di biscotti ingredienti farina di frumento zucchero grassi vegetali olio di palma  amido di mais sciroppo di zucchero glucosio latte in polvere cacao in r polvere agenti lievitanti e  ii e i e i e i sale emulsionante or lecitina di sola color caramello ed cioccolato  aroma artificiale n vaniglia latte burro cioccolato crema pasticcera aromi naturali burro el latte e  condizionatore della pasta metabisolfito di sodio coloranti e  e   e  e  zucchero grassi vegetali olio di palma latte in polvere cacao in polvere pasta di cacao emulsionante lecitina di soia prodotto da sri lanka gredients in bold lu gluten voir les ingredients en gras iehe zutaten fett gedruckt edere gli ingredienti in grassetto informazioni nutrizionali ri ri for an iscuits rm average adult tains kj e e e may have an adverse effect on activity and attention in childrene e e peut avoir un effet negatif sur lactivite et  kj   ,Sugary snacks,Biscuits and cakes
3190719975557,a consommer de preference avant le ou dcr date de consommation recommandee n lot centre  oeufs bio eufs frais de qualite ab ceufs frais de qualite pondus ance a ab ,Fish Meat Eggs,Eggs
3190719975557, ceufs biologiques de categorie a la signification du code du producteur imprime sur loeuf est o ceufs biologiques fr  france  lettres identification du producteur  chiffres numero du batiment a conserver au refrigerateur apres achat earl la plume blanche  chemin de la sine  vence telfax      ,Fish Meat Eggs,Eggs
3192200002117,original hampo lorigh us de pomme ,Beverages,Fruit juices
3192200002117,jus de pomme petillant ingredients jus de pomme gaz carbonique ,Beverages,Fruit juices
3192200002117, ml  ml  ml declaration nutritionnelle  kj  kj  kcal  kcal g  energie  g matieres grasses dont acides gras satures glucides dont sucres proteines sel g  g  g  g o g   g   g  g   ol o ,Beverages,Fruit juices
3192200002117, verre de  ml co calories suces lipides aal  des reperes nutritionnels joul adulte ayant un apport moyen de  valeurs nutrition moyennes pour  energie  kj  kcal proteines g glucides g dont sucres lipidesog dont acides gras sal fibres alimentairesg sodium trace a consommer de preferenca avant ,Beverages,Fruit juices
3192200002117,urs nutritionnelles moyennes m energ  kj  kcal oteines incides  ont sure  i unides dent ocides gras satures o효 itaine fibres alimentaire o g everp en  go ga g g    el dwvho bet w ,Beverages,Fruit juices
3192200002117, ml declaration nutritionnelle  ml  ml  kj  kj  kcal  kcal  g energie  matieres grasses dont acides gras satures glucides dont sucres proteines sel g  g g  g g  g  g g   g g g   do le ,Beverages,Fruit juices
3192200002117,porarar ngres ajoutes sansalcool utes ,Beverages,Fruit juices
3192200002117,jus de pomme petillant ingredients de pomme gaz carbonique sans colorant sans conservateur conformementala reglementation une bouteille e  cl contient  verres  de  ml a conserver ,Beverages,Fruit juices
3192200002117,hamp m loriginal s de pomme petillant ,Beverages,Fruit juices
3192200002117,mne frat sur champomyfr depommepetillant verre  ml conhen lngredients purjus de pomme gaz carbonique scnsakool sans colorant sans conservateur onormementakareglementotionune bouteille d content  verres  de  m yzkol conserver alobri du soleil et de la chaleur  morgue service du proprietaire de ayant un apport moyen de moyennes n cheppes consommateurs rangina  valeurs nutritionnelles ance cs provence cedex  france indiquer la eele numero de olinscrits etiquette proteines glucides dont sucre service consommateurs cn cristal      lipides saltures appel non surtaxa service valable uniquement en france metropolitaine fibres alimen mmer de preference avant le sodium  t bouchon bouteille verre elements metal a jeter a recycler jocalement wwnconsignesdetrifr ,Beverages,Fruit juices
3192200002117,sino iam original champo jus de pomme petilla ,Beverages,Fruit juices
3192200002117,a and ml content une ded bouteille  verres  de  lipides acidesgas sat ce produit contat kcal g trace naturellement preset   commercialise in des repares france ne adulte ayant un nutritionnels journaliers pour un  levalloisparat apport moyen de  kcal par jour moyennes de la marque semi pour  ml energie  kj  kcal proteines g glucides g dont sucres  g upides og dont acides gras saturesg fibres alimentaires g sodium trace mer de preference avant le  t  ,Beverages,Fruit juices
3192200002117,tam original champo corigiae jus de pomme petillan ,Beverages,Fruit juices
3192200002117,wwwchampom jus de pomme petillant lngredients pur jus de pomme gaz carbonique sans alcool sans colorant et sans conservateur conformement une bouteille de  cl contient  verres  de  ml a conserver sodum labri du soleil et de la chaleur s race ce produit contient les sucres fruits naturellement presents dans les  commercialise par orangina schweppes france  rue victor hugo oliers pour un  levalloisperret cedex france jour ntionnelles fabrique avec lautorisation du proprietaire de la marque service consommateurs nal  orangina schweppes france  aixenprovence cedex  france indiquer la date et le numero du lot inscrits sur letiquette ins est  cl ,Beverages,Fruit juices
3192200002117,jus de pomme petillant ingredients jus de pomme gaz carbonique sans conservateur ni colorant comme tous les jus ene de fruits sans alcool a conserver a labri du soleil et de la chaleur apres ouvertyredo conserver au refrigerateur ef consommer dans sat les  jours dec nut ma glu sel bouteille sous pression a ouvrir avec don precaution par un adulte en maintenant pro le bouchon  ,Beverages,Fruit juices
3192371105778,vin de bordeaux grah de fra con medaille dor  chateau freybernat bordeaua appellation bordeaux contrgl  mis en bouteille au chateau gaec de freybernat recoltant a ladaux  france produt e ro ,Fat and sauces,Dressings and sauces
3192371105778,vin de bordeaux chateau freybernat bordeaua appellation bordeaux controle  irs jolie robe rubis agrementee de reflets carmines bouquet ample e agreable ou lon decouvre des nuances de fruits a noyau et depices sur un leger fond empyreumatique en bouche le vin est souple dote de tannins au equilibre avec une vinosite discreete et une fraiche vivacite grain fin et mur en voici un bordeaux tendre et delicat a deguster des maintenant ou dici  ans a la temperature de c pour accompagner les repas legers ainsi a very lovely ruby red enlivened by carmine highlights a full and on the palate the wine is soft endowed with fine ripe tannins balanced by here is a gentle delicate bordeaux enjoy now or within  years at  c que les volailles et le veau rotis ou en sauce pleasant bouquet with nuances of walnut and spices background on a light burnt iscreet vinosity and fresh vitality with light meals poultry and veal either roasted or served with sauce produit de france m indeholder sulfittersisaltaa sulfiitteja inneholder sulfitterzawiera siarczyny   contient sulfitescontains sulphites enthalt sulfitebevat sulfieten o ,Fat and sauces,Dressings and sauces
3193482624073,l        s taboule volaille salade de dinde standard cuit traite de s et jambon en salaison assaisonnee ngredients jambon de din semoule de ble dur ehydratee  mais poivrons rouges et verts sel standard cu aite en salaison  haut de et pilon de dinde  eau dextrose proteines de po stabilisants e e sirop de glucose conservateurs e e aromes de eau de e sel ketchup puree de tomates dextrose sucre vinaigre dalcool sel amidon transforme arome arome epices et plantes aromatique conservateur e traces eventuelles de crustace oeuf valeurs nutritionnelles pour g poisson celeri mollusque lait  kj  kcal energie  g matieres grasses conditionne sous atmosphere protectrice dont acides gras  g satures glucides a conserver entre  et  c  g dont sucres a consommer jusquau voir a date proteines figurant sur lemballage  a consommer rapidement apres ouverture lse poids net pensez film plastnque au tri g e    fabrique par bti  rosporden  ,Composite foods,One-dish meals
3193482624059,   betteraves rouges salade de betteraves rouges assaisonnees ingredients betteraves rouges  huile de colza moutarde eau graines de moutarde vinaigre sel vinaigre dalcool sel conservateur e traces eventuelles de  gluten crustace ceuf poisson lait celeri mollusque valeurs nutritionnelles pour g energie matieres grasses dont acides gras satures glucides dont sucres proteines sel conditionne sous atmosphere protectrice  kj  kcal  g a conserver entre et c a consommer jusquau  voir la date figurant sur lemballage a consommer rapidement apres ouverture g  g  g  g  g poids net g e pensez au tri barquette et film plastique a jeter consigne pouvant varier localement wwwconsignesdetrifr    fabrique par bti  rosporden  ,Composite foods,One-dish meals
3193482627432,     taboule au basilic salade de semoule de ble dur legumes et basilic assaisonnee ngredients semoule de ble dur rehydratee  legumes  concombres poivrons jaunes tomates oignons deshydrates huile de colza huile dolive vierge extra  vinaigre dalcool basilic  sel pers sucre aromes piment despelette conservateur sorbate de potassium traces eventuelles de ceuf lait poisson crustace mollusque moutarde celeri valeurs nutritionnelles pour   kj  kcal energie  g matieres grasses conditionne sous atmosphere protectrice dont acides gras  g satures ies  a conserver entre  et  c  g dont sucres a consommer jusquau voir la date  g proteines figurant sur lemballage se a consommer rapidement apres ouverture  g barquette et pensez film plastique poids net autr a jeter g e      fabrique par bti  rosporden  ,Composite foods,One-dish meals
3193482623991,carottes rapees carottes rapees assaisonnees ingredients carottes  eau huile de colza vinaigre dalcool moutarde eau graines de moutarde vinaigre dalcool sel sel epaississants e  e aromes conservateur e traces eventuelles de gluten celeri lait oeuf poisson crustace mollusque valeurs nutritionnelles pour g energie matieres grasses dont acides gras satures glucides  kj   kcal conditionne sous atmosphere protectrice  g a conserver entre et c a consommer jusquau  voir la date  g  g  g figurant sur lemballage mmer rapidement apres ouverture dont sucres proteines  g  g o ,Composite foods,One-dish meals
3193482623991,  l  carottes rapees carottes rapees assaisonnees ingredients carottes  eau huile de colza vinaigre dalcool moutarde cau graines de moutarde vinaigre dalcool sel sel epaississants eea aromes conservateur  e traces eventuelles de  gluten celeri lait ceuf poisson crustace mollusque valeurs nutritionnelles pour g energie matieres gra dont acides gras satures glucides dont sucres proteines sel  kj  kcal  g  g  g conditionne sous atmosphere protectrice a conserver entre et c a consommer jusquau  voir la date figurant sur lemballage a consommer rapidement apres ouverture pensez au tri barquette et film plastique a jeter consigne pouvant varier localement wwwconsignesdetrifr poids net og    fabrique par  bti  cs    rosporden  ,Composite foods,One-dish meals
3193482623991,carottes rapees assaisonnees ingredients carottes  eau huile de colza vinaigre dalcool moutarde eau graines de moutarde vinaigre dalcool sel sel epaississants e e aromes conservateur  e traces eventuelles de gluten celeri lait oeuf poisson crustace mollusque valeurs nutritionnelles pour g energie matieres grasses dont acides gras satures glucides dont sucres proteines sel  kj  kcal  g conditionne sous atmosphere protectrice a conserver entre  et  c a consommer jusquau  voir la date figurant sur lemballage a consommer rapidement apres ouverture  g  g  g  g  g pensez au tri barquette et film plastique a jeter consigne pouvant varier localement wwwconsignesdetrifr ,Composite foods,One-dish meals
3193482623991,    carottes rapees carottes rapees assaisonnees ingredients carottes  eau huile de colza vinaigre dalcool moutarde eau graines de moutarde vinaigre dalcool sel sel epaississants  e e aromes conservateur  e traces eventuelles de  gluten celeri lait ceuf poisson crustace mollusque valeurs nutritionnelles pour g energie matieres grasses dont acides gras satures glucides dont sucres proteines sel  kj   kcal conditionne sous atmosphere protectrice  g a conserver entre  et c a consommer jusquau voir la date figurant sur lemballage a consommer rapidement apres ouverture  g  g  g  g g barqueteu a jeter wwwconsignesdetrifr pensez au tri consigne pouvant varier localement poids net g    fabrique par  btics  rosporden  ,Composite foods,One-dish meals
3193482626930,salades de pates vegetariennes ,Composite foods,One-dish meals
3193482626930, torsades aux trois couleurs salade de torsades trois couleurs et legumes assaisonnee ingredients specialites cerealieres  semoule de ble dur poudre de tomates poudre depinards poudre de blanc doeuf legumes  carottes poivrons rouges et verts eau huile de colza sel vinaigre dalcool plante aromatique moutarde conservateur e traces eventuelles de crustace lait celeri mollusque poisson valeurs nutritionnelles pour g  kj  kcal energie matieres grasses  g conditionne sous atmosphere protectrice dont acides gras satures  g  g glucides a conserver entre  et c dont sucres  g a consommer jusquau voir la date proteines  g figurant sur lemballage a consommer rapidement apres ouverture sel poids net barquette et pensez film plastique autr a jeter g e consigne pol varie alem consignes    fabrique par bti  rosporden  ,Composite foods,One-dish meals
3193482626930,salades de pates vegetariennes ,Composite foods,One-dish meals
3193482626930,salades de pates vegetariennes ,Composite foods,One-dish meals
3193482624011,atal aurro poids net g  fabrique par bti cs   rosporden  tabouletal oriental ,Composite foods,One-dish meals
3193482624011,    taboule oriental salade de semoule et legumes assaisonnee ngredients seimoule de ble dur rehydratee  legumes  tomates poivrons rouges et verts oignons deshydrates huile de colza vinaigre dalcool herbes aromatiques sel jus de traces eventuelles de moutarde celeri ceuf lait poisson crustace mollusque valeurs nutritionnelles pour g conditionne sous atmosphere protectrice  kj  kcal energie  g a conserver entre  et c matieres grasses a consommer jusquau voir la date dont acides gras figurant sur lemballage  g satures a consommer rapidement apres ouverture glucides  g  g dont sucres  g proteines poids net barquette et pensez film plastique autr a jeter g e consigne pouvant er locaiement wwwconsignesdetri    fabrique par bti  rosporden  ,Composite foods,One-dish meals
3193482624011,    taboule oriental ade de semoule de ble dur rehydratee legumes assaisonnee edients mule de ble dur rehydratee  tomates  huile de colza poivrons verts  s rouges  vinaigre dalcool oignons deshydrates  menthe douce sel us concentre de citron epice arome conservateur  e eventuelles de moutarde celeri ceuf lait poisson crustace mollusque  valeurs nutritionnelles pour g energie matieres grasses dont acides gras satures glucides dont sucres proteines sel  kj  ko nne sous atmosphere protectrice  g wer entre et c mer jusquau  voir la date ur lemballage mer rapidement apres ouverture  g  g  g  g  g pensez au tri barquette et film plastiqu a jeter consigne pouvant varier loca wwwconsigne    fabrique par  btics  ,Composite foods,One-dish meals
3193482624011, i   taboule oriental salade de semoule de ble dur rehydratee et legumes assaisonnee ingredients semoule de ble dur rehydratee  tomates  huile de colza poivrons verts  poivrons rouges  vinaigre dalcool oignons deshydrates  menthe douce sel persil jus concentre de citron epice arome conservateur  e traces eventuelles de  moutarde celeri ceuf lait poisson crustace mollusque valeurs nutritionnelles pour g energie matieres grasses dont acides gras satures glucides dont sucres proteines sel  kj  kcal  g conditionne sous atmosphere protectrice a conserver entre et  c a consommer jusquau voir la date figurant sur lemballage a consommer rapidement apres ouverture  g  g  g  g pensez au tri barquette et ajeter stique consigne pouvant varier locale wwwconsigneso poids net g   fabrique par  btics  rosporden  ,Composite foods,One-dish meals
3193482626961,salades de pates vegetariennes ,Composite foods,One-dish meals
3193482626961, f       penne aux petits legumes salade de penne aux petits legumes assaisonnee ingredients doeuf specia cerealieres  semoute de ble dur poudre de blanc legumes  courgettes carottes mais tomates oignons eau huile de colza vinaigre dalcool aromes gluten celer set pulpe dail ail rehydrate sel conservateur anhydride sulfureux moutarde eau ines de moutarde vinaigre se epaississants e e conservateur e traces eventuelles de crustace ait mollusque poisson valeurs nutritionnelles pour g  kj  kcal energie mati grasses conditionne sous atmosphere protectrice dont acides gras satures glucides a conserver entre  et  c dont sucres a consommer jusquau voir la date  g proteines figurant sur lemballage  g a consommer rapidement apres ouverture lsel barquette et poids net pens film plastique autri a jeter g e consigne pouv wwwconsignesdetn    fabrique par bti  rosporden  ,Composite foods,One-dish meals
3193482626961,salades de pates vegetariennes ,Composite foods,One-dish meals
3193482626961,salades de pates vegetariennes ,Composite foods,One-dish meals
3193482624028,poids net e brique par bti  rosporden  p      piemontaise salade de pommes de terre et epaule de porc standard en sauce pommes de terr  dont antioxydant disulfite de sodium sauce  eau huile de colza vinaig dalcool moutarde eau graines de moutarde se oeuf entier pasteurise liquide amidon modifie de pommes de terre sel epaississants e plasma epaule de porc standard  epaule de eau dextrose de p sel stabilisant e acidifiant e conservateurs e cornichons cornichons vinaigre sel affermissant e conservateur disulfite de potas oeufs durs persil conservateur e traces eventuelles de gluten crustace poisson lait celeri mollusque valeurs nutritionneiles pour g energie  kj  kcal matieres grasses  g conditionne sous atmosphere protectrice dont acides gras satures  g a conserver entre  et c  g glucides a consommer jusquau voir la date dont sucres figurant sur lemballage proteines a consommer rapidement apres ouverture se  poids net ette et pe lastique g e a jeter consigne wwwcons  l     fabrique par bti  rosporden  ,Composite foods,One-dish meals
3193482625797,museau de porc salade de museau de porc assaisonnee ngredients de porc  tete de porc  eau sel dextrose epices gelatine de porc colorant e conservateur e sauce eau huile de colza moutarde eau graines de moutarde vinaigre se vinaigre dalcool epaississants e e arome cornichons cornichons vinaigre sel affermissant e conservateur disulfite de potassium oignons rehydrates persil conservateur e traces eventuelles de gluten celeri lait ceuf poisson crustace mollusque valeurs nutritionnelles pour g  kj  kcal energie  g matieres grasses conditionne sous atmosphere protectrice dont acides gras satures  g a conserver entre  et c glucides a consommer jusquau voir la date  g dont sucres figurant sur lemballage  g proteines a consommer rapidement apres ouverture se poids net barquette et filmplastique au tri g e a jeter consigne pouvant varier localement wwwconsignesdetmtr     fabrique par bti  rosporden  ,Composite foods,One-dish meals
3193482624004,     l  celeri remoulade celeri rape sauce remoulade ingredients celeri  sauce remoulade  eau huile de colza moutarde eau graines de moutarde vinaigre sel vinaigre dalcool oeuf entier pasteurise liquide sel amidon traces eventuelles de ait poisson crustace gluten mollusque conditionne sous atmosphere protectrice valeurs nutritionnelles pour g energie  kj  kcal a conserver entre  et c matieres grasses  g a consommer jusquau voir la date dont acides gras figurant sur lemballage satures  g a consommer rapidement apres ouverture glucides  g dont sucres  g proteines sel  poids net barquette et film plastique au tr g e a jeter consigne pouvant varier localement      fabrique par bti  rosporden  ,Composite foods,One-dish meals
3193482624042,     macedone de legumes macedoine de legumes en sauce ingredients macedoine de legumes  legumes verts  minimum petits pois haricots verts navets sauce  huile de colza eau vinaigre dalcool se arde eau es de vinaigre sel poudre de jaune doeuf emulsifiant e epaississants e e conservateur e traces eventuelles de gluten crustace poisson lait celeri mollusque valeurs nutritionnelles pour g energie  kj  kcal matieres grasses  g conditionne sous atmosphere protectrice dont acides gras satures  g a conserver entre  et  c glucides  g a consommer jusquau voir la date dont sucres  g figurant sur lemballage proteines a consommer rapidement apres ouverture sel  poids net pensez g e film plastique au tri a jeter consigne pouvant er men      fabrique par bti  rosporden  ,Composite foods,One-dish meals
3198172000120,valeurs nutritionnelles moyennes pour gde gde corn flakes corn  ml de lait flakes corn flakes demiecreme valeur  kcal  kcal  koal energetique    kj a la proteines glucides totaux   g  g ont sucres totaux  g ont amidon   g  g lipides   g  g dont satures   g  g fibres alimentaires  g  g sodium  g  g  g equivalent sel   g  g en vitamines en en des aur des aur des aur b  mg    b r  mg     mg    b  mg    b acide folique  hg    b  ug    mineraux csla  mg  fer ja   ajr apports journaliers recommandes ,Cereals and potatoes,Breakfast cereals
3198172000120,vitamines pp b b b b b fer allergenes ingredient issu de lorge ,Cereals and potatoes,Breakfast cereals
3198172000120,chaque portion de  g contient calories sucre lipid dont sel   g  g  g  g    des reperes nutritionnels journaliers  ,Cereals and potatoes,Breakfast cereals
3196309014378,certifie agriculture les terrines normandie delices bio rillettes de boeuf normand ,Salty snacks,Salty and fatty products
3196309014378,taonn  lowmandin gle ki  koal matiores grasses g don aaldes gras satures   g glucides g dont suores  g protdines h   g ,Salty snacks,Salty and fatty products
3196309014378,ingredlents viande de porc  viande de boeuf  gras de pore   jus de cuisson sel de guerande polvre bouquet garni ,Salty snacks,Salty and fatty products
3193670033458,thon albacore au naturel peche a la ligne phare deckmuhl ,Fish Meat Eggs,Fish and seafood
3193670033458,ingredients th ihl al te thon albacore thunnus albacares eau sel prepare par chancerelle f  douarnenez france ,Fish Meat Eggs,Fish and seafood
3193670126914,aearers mas sardines sans aretes connetable depuis  au piment a lhuile dolive aiche omega medium shg ,Fish Meat Eggs,Fish and seafood
3193670126914,ingredients sardines huile dolive vierge extra piment rouge  sel arome naturel ,Fish Meat Eggs,Fish and seafood
3193670126914,valeurs nutritionnelles moyennes pour  g de poisson egoutte energie   kj  kcal g matieres grasses dont acides gras satures monoinsatures polyinsatures g  g  g  g glucides dont sucres fibres alimentaires proteines sel  g  g omega    o o o ,Fish Meat Eggs,Fish and seafood
3067681081534,bonduelle carottes rapees au citron de sicile format genereux  pour g  kcal  kj ,Composite foods,One-dish meals
3067681081534,salade de carottes rapees au citron assaisonnee ingredients  carottes  eau huile de colza vinaigre dalcool sel sucre jus de citron de sicile  moutarde de dijon eau graines de moutarde vinaigre dalcool sel extrait de zeste de citron amidon transforme de pomme de terre epaississants  gomme xanthanegomme guar antioxydant acide ascorbique puree dail arome naturel de poivre fabrique dans un atelier utilisant egalement  gluten celeri lait crustace oeuf poisson fruits a coque sans conservateur et sans arome artificiel a consommer rapidement apres ouverture a consommer jusquau  voir face avant conditionne sous atmosphere protectrice poids net a conserver entre c et c g pensez au tri barquette film couvercle plastique a jeter consione pount vre localemen cos ,Composite foods,One-dish meals
3067850000502,sian re brochettes yakiteri de noulet marine euit  sauce soja brochettes de poulet marine cuit sauce soja  g surgelees poids net  k suggestion de laregelunca ,Composite foods,One-dish meals
3067850000502,declaration nutritionnelle pour  gr  kj  kcal valeur energetique g  g graisses  dont acides gras satures  g  g glucides  dont sucres  g proteines  g sel ,Composite foods,One-dish meals
3067850000526,ingredents morceaux de cuisse de poulet dasossae avec peau marinas  poulet  marinade eau assaisonnement sauce soja soja bla sel eau sucre sirop de malt amidon de maa is exhausteur de goat e vinaigre sel colorant caramel ordinaire poivre noir stabilisant  e sel stabilisant  e correcteur dacid ita e sauce soja   sauce soja soja bla sel eau sucre exhausteu de goat e et e amidon de maa s alcool de riz riz sucre alcool eau colorant caramel ordinaire apaississant e issus danimaux nas alevas abattus en chine produit traita en salaison ,Composite foods,One-dish meals
3068110380266,d uncine farine bonnes het refern de tous usaiges t ,Cereals and potatoes,Cereals
3068110380266,francine ble ier la cuisu e ureuses sachet referma farine de tous usages t prodult kg botran rerlels ,Cereals and potatoes,Cereals
3068110380266,ingredient  nutrition francine a soigneusement selectionne les meilleurs bles de francepour vous garantir une farine dune grande qualite ingredient farine de ble type  ,Cereals and potatoes,Cereals
