barcode,clean_text,pnns_groups_1,pnns_groups_2
3068320080000,calcium ca magnesium mg sodium na potassium k silice si mineralisation totale samenstelling mgl      bicarbonates hco  sulfates s  chlorures c  nitrates no  teneur totale en sels mineraux ahoeveelheid minerale zouten bij c  mglph  eau minerale naturelle natuurlijk mineraalwater source cachat bronsaeme  evian france info conso gratuitgratis fr    danoneaunaturelcom saeme bp  evian nv danone waters benelux sa rue j cockxstraat  b  bxl info gratis b l  nl  consumerbeneluxdanonecom a consommer de preference avant la date indiquee sur la bouteille a garder a labri du soleil dans un endroit propre sec et tempere ten minste houdbaar tot zie fles droog fris rein en uit de zon bewaren ,Beverages,Waters and flavored waters
3068320080000,mineralisation totale mglitre calcium c  bicarbonates hco  magnesium mg  chlorures cl  sodium na potassium k  nitrates no  silice sio teneur totale en sels mineraux source cachat saeme  evian france info consommateurs fr danorgaunaturel com sa eme bp   evian d a consommer de preference avant la date indiquee la bouteille garder labri du soleil dans un endroit propre sec ettempere ,Beverages,Waters and flavored waters
3068320080000,evian eau minerale naturelle ,Beverages,Waters and flavored waters
3068320085005,pokka intl pte ltd  benoi crescent singapore  sutl corporation pte ltd sutl house j pasir panjang roa  singapore   a consommer de preference avant la date ndiquee sur la bouteille a garder a labri du soleil dans un endroit propre se et tempere embouteile a la source cachat par sae m e  evian france danoneaunaturelcom information for hong kong usage onlyinformation exclusivement a lusage de hong kong composition minerale ,Beverages,Waters and flavored waters
3068320084602,evian eau minerale naturelley naturliches mineralwasser ,Beverages,Waters and flavored waters
3068320084602,mineralisation totale gesamtmineralisation mgl   hydrogencarbonat hco  calcium cat magnesium mgt  sulfat so atrium na alium k siliciumdioxid s  teneur totale en sels mineraux a c abdampfruckstand bei c    chiorid cl nitrat no lon jus auss teles ormer elles mglph a consommer de preference avant la date indiquee sur la bouteille a garder a labri du soleil dans un endroit antient pet ecycle opre sec et tempere cette boutelle produite avec  de rpet nous lastique recycle la couleur peut  recyclabl jutes varier dune bouteille a lautre tique pet ercle mindestens haltbar bis siehe flaschenhals vor sonnenlicht eviancc geschutzt ho p ,Beverages,Waters and flavored waters
3068320084602,mineralisation totale gesamtmineralisation mglitre calcium ca magnesium mg  sulfates s sodium na potassium k silice si  bicarbonates hco      chlorures ci  nitrates no  teneur totale en sels mineraux a c abdampfruckstand c mgiph  a consommer de preference avant la date indiquee sur la bouteille a garder a labri du soleil dans un endroit propre sec et tempere mindestens haltbar bis siehe flaschenaufdruck vor sonnenlicht geschutzt trocken kuhl und sauber lagern ,Beverages,Waters and flavored waters
3068320084602,leau evian des bebes loms recommande un allaitement exclusit usqua  mois die who empfiehlt usschliessliches stillen wahrend  monaten sourcequelle cachat saeme  evian o france evianvolvic suisse sa leutschenbachstr  ch zurich siteevianch tel     ea eau pet eviancom natu gps  oa    ,Beverages,Waters and flavored waters
3068320084602,mineralisation totale gesamtmineralisation mglitre  bicarbonates hco  calcium ca magnesium mg  sulfates s sodium na    chlorures cl  nitrates no   potassium k silice sio teneur totale en sels mineraux a c abdampfruckstand  c mglph  a consommer de preference avant la date indiquee sur la bouteille a garder a labri du soleil dans un endroit propre sec et tempere mindestens haltbar bis siehe flaschenaufdruck vor sonnenlicht geschutzt trocken kuhl und sauber lagern l ,Beverages,Waters and flavored waters
3068320084602,leau evian taliactau des bebes oms recommande un allaitement exclust jusqua  mois die who empfiehlt gusschliessliches stillen wahrend  monaten sourcequelle cachat saeme  evian o france evianvolvic suisse sa e  leutschenbachstr  ch zurich siteevianch tel    ea eau nat eviancom ,Beverages,Waters and flavored waters
3068320084602,evian eau minerale naturelley naturliches mineralwasser ,Beverages,Waters and flavored waters
3068320160108, sour ce saint galrgier badoit finement petillante leicht kohlensaurehaltio ,Beverages,Waters and flavored waters
3068320160108,id he che  sourc e saint galmer badoit finement petillante leicht kohlensaurehaltig ,Beverages,Waters and flavored waters
3068320160108,stos e badoit source ,Beverages,Waters and flavored waters
3068320160108,adonpsm uap ope eau minerale naturelle avec adjonction de gaz carbonique  calcium ca sodium na  chlorures ci  sulfates s   ruches mineralwasser mit kohlensaure versetzt mineralisation analyse mg residu sec a abdampfruckstand bei cmgl ph  gnesium mg potassium k   fluorures bicarbonates hco  silice si  a consommer de preference avant la date indiquee sur la bouteille  mindestens haltbar bis siehe flasche a stocker a labri du soleil dans un endroit propre sec et tempere  vor licht schutzen sauber trocken und kuhl lagern source badoit quelle saeme  saint galmier fr produit en france cpl  ,Beverages,Waters and flavored waters
3068320160108,evianvolvic suisse sa leutschenbachstr  ch zurich tel    pet   ,Beverages,Waters and flavored waters
3068320160108,reference avant la naturellement riche en bicarbonates bouteille garder eau minerale naturelle un endroit propre avec adjonction de gaz carbonique caracter lusage exclusif mineralisa a badoit saeme produit en france residu sec a  c  mg evian volvic  sulfates   fribourg calcium  potassium sodium  bicarbonates  fluorures  ectif  silice  magnesium  chlorures ,Beverages,Waters and flavored waters
3068320160108,pet no aujourdhui t grace votre geste de tr  des bouteilles sont recyclees objectif  trons plus pour environnement eco chambre minerales des ,Beverages,Waters and flavored waters
3068320014449,eau minerale naturelle source cachat saeme  evian mineralisation caracteristique en mgl alcium  bicarbonates  magnesium  sulfates  chlorares  sodium potassium tuates siliwe  service cons mamateur n azur      prey appel local a consommer de preference avant fin     ,Beverages,Waters and flavored waters
3068320019628,boisson leau minerale naturelle petillante ingredients eau mineralenaturelle gazelfiee la salvetat  arome naturel de avant la date indiquee surla autri i ol bac bouteille garder labri du soleil dans un endroit propre sec et tempere embouteillee la salvetat sur agout  par saeme  evian valeurs par par portion ar par valeurs par par portion ar par nutritionnelles  ml  ml  ml nutritionnelles  ml  ml  ml glucides energie dont sucres matieres grasses proteines dont acides gras satures og sel ar apports de reference pour un adulte type  g  kcal cette bouteille contient  portions de  ml cbaoo ,Beverages,Waters and flavored waters
3068320019628,nouvelle recette finement peti salvetat sucres agrume sans aucun additie ,Beverages,Waters and flavored waters
3068320019628,boisson a leau minerale naturelle petillante a i arome naturel de pamplemousse sans sucres ingredients eau minerale naturelle gazeifiee la sal  arome naturel de pamplemousse pensez autri bouteille garder ndiquee sur la labri du soleil dans un endroit propre bac de sec et tempere embouteillee la salvetat sur agout  tri par saeme  evian par par portion ar par par par portion ar par valeurs valeurs nutritionnelles  ml  ml  ml nutritionnelles  ml  ml  ml glucides energie  dont sucres matieres grasses dont acides grassatures og og proteines g g  ar apports de reference pour un adulte type sel  klkcal cette bouteille contients portions de  ml ,Beverages,Waters and flavored waters
3068320019628,nouvelle recette finement salvetat agrumes sans aucun additif ,Beverages,Waters and flavored waters
3068320019628,verreml nergie info consommateurs     prix dun appel local danoneaunaturel com lengagement naturalite de leau minerale naturelle petillante la salvetat des aromes naturels de fruits sans edulcorants cv sans conservateurs   ,Beverages,Waters and flavored waters
3068320019314,evian ce eau minerale naturelle natuurluk mineraalwater cl ,Beverages,Waters and flavored waters
3068320019314,evian eau minerale naturelle naturliches mineralwas ,Beverages,Waters and flavored waters
3068320019314,mineralisation totalegesamtmineralisation mglite calcium ca  magnesium mg  sodium na  potassium k  silice sio  bicarbonates hco  sulfates so  chlorures cl  nitrates no  teneur totale en sels mineraux a abdampfruckstandc mgp a consommer de preference avant la date indiquee sur la boute a garder a labri du soleil dans un endroit propre sec et tempere mindestens haltbar bis siehe flaschenaufdruck vor sonnenliaht geschutzt trocken kuhl und sauber lagern en plus source cachat saeme  evian france mevian ch evian volvic suisse tel     ,Beverages,Waters and flavored waters
3068320019314,evian boo eau minerale naturelle natuurliuk mineraalwater c ,Beverages,Waters and flavored waters
3068320019314,mineralisation totale mglitre aicium ca  magnesium mg  sodium na en potassum k  silice si  bicarbonates hc  states si  chlorures cl  nitrates no  ierer t tae en seis mineraux c mgl p  onsommateurs fr    danoneaunature com saeme bp   evian her de preference avant la date indiquee sur la agarder tabri du soleil dans un endroit sec es pas laisser ce bouchon a a ne d un enfant de moins de mois sans la surveillance dun pensez au tri au tril de france aene evian france ,Beverages,Waters and flavored waters
3068320019314,vi ce evian eau minerale naturelle katuurluk mineraalwater ззая ,Beverages,Waters and flavored waters
3068320019321,evian ,Beverages,Waters and flavored waters
3068320019321,meralisation totalesamenstelling mg  chiorures tur totale en sels mineraux a hoeveelheid minerale  bicarbonates hco   ln cat mag mgt  suitates s socd na p k sice s nitrates noj  outen bi cmglph  source cachat bronsaeme  evian france info consommateurs fr danoneaunaturelcom e saeme bp  evian     serviceappe gratuits v danone waters benelux sa qual des usineswerkhuizenkaai   brussels info gratis b  elle er  nl  consumerbeneluxdanonecom a consommer de preference avant la date indiquee sur la boutelle a conserver a labri du solel dans un endroit propre c et tempere ten minste houdbaar tot zle fles eau nat drog tris rein en ult de zon bewaren ,Beverages,Waters and flavored waters
3068320011837,net ap ub  s o r ce saint lyf badoit finement petillante chtbruisend xcl ,Beverages,Waters and flavored waters
3068320011837, s o u r c e saint badoi finement p tillante cl ,Beverages,Waters and flavored waters
3068320016078, s o u r c e badoit ntensementpetillante ,Beverages,Waters and flavored waters
3068320016078,eau mineral naturelle calcium ca chlonrescr  avec adjonction de gaz carbonique  sodium na ssisultates sur  mineralisation  analyse mgl magnesium mg kluonresf  potassium k  residu sec a c   mgl ph  bicarbonates holy slice s  sio  a consom mer de preference avant la date indiquee sur la bouteille a stocker a labri du soleil dans un endroit propre sec et tempera source badoit saeme  saint garnier fr produit en france distribution ch  evianvolvicsuisse sa cp  fribourg cpc  fr  ,Beverages,Waters and flavored waters
3068320016078, s o u r c e ain badoit ntensementpetillante ,Beverages,Waters and flavored waters
3068320011066,mineralisation totale gesamtmineralisation mglitre calcium ca magnesium mg  sulfates so sodium na potassium k silice sio  bicarbonates hco  eviane est  pure el au long hydra  chlorures cl  nitrates no     teneur totale en sels mineraux a abdampfruckstand cmglph a consommer de preference avant la date indiquee sur la bouteille a garder a labri du soleil dans un endroit propre sec et tempere mindestens haltbar bis siehe flaschenaufdruck vor sonnenlicht geschutzt trocken kuhl und sauber lagern ,Beverages,Waters and flavored waters
3068320011066,evian eau minerale naturelle naturliches mineralwasser ,Beverages,Waters and flavored waters
3068320011066,sourcequelle cachat saeme evian france evianvolvic suisse sa leutschenbachstr  ch zurich siteevianch tel     dectclable pet eau na eviancom gps  ch   ,Beverages,Waters and flavored waters
3068320011066,evian eau minerale naturelle naturliches mineralwasser ,Beverages,Waters and flavored waters
3068320011066,sourcequel saeme s e evianvolvic suis leutschenbachst o ch zunich otel     siteevianch i pet recycle evian l  ,Beverages,Waters and flavored waters
3068320011066,mineralisation totale gesamtmineralisation mglitre calcium ca magnesium mg  sulfates s sodium na  bicarbonates hco   chlorures cl eviane est   pure el au long hydra potassium k silice sio  nitrates no   teneur totale en sels mineraux a abdampfruckstandcmgl ph a consommer de preference avant la date indiquee sur la bouteille a garder a labri du soleil dans un endroit propre sec et tempere mindestens haltbar bis siehe flaschenaufdruck vor sonnenlicht geschutzt trocken kuhl und sauber lagern ,Beverages,Waters and flavored waters
3068320011066,sourcequelle cachat saeme  evian france evianvolvic suisse sa leutschenbachstr  ch zurich siteevianch tel      pet eau na eviancom ,Beverages,Waters and flavored waters
3068320011066,cas co  mineralisation totale gesamtmineralisation mglitre calcium ca magnesium mg  sulfates so sodium nat potassium k  bicarbonates hco   chlorures cl   silice sio  nitrates no  teneur totale en sels mineraux a abdampfruckstandcmgph ,Beverages,Waters and flavored waters
3068320014531,wwwshoppingkompassde evian eau m water ral mineral naturliches mineralwasser ,Beverages,Waters and flavored waters
3068320014524,evian au minerale naturelle atorliches mineralwas e wate ,Beverages,Waters and flavored waters
3068320014524,au al inerale natuurliuk mine rliches moment fries de crudites mes ae artisanal de camp jalade de champignons cr salade de haricots cru verts ceviche la peruvienne so le de trio laigle dor harico les risotti  risotto carn minutes de t ,Beverages,Waters and flavored waters
3068320011820, aint badoit finement petillante ,Beverages,Waters and flavored waters
3068320011820, sour spent galmes badoit finement petillante ,Beverages,Waters and flavored waters
3068320011820,eau minerale naturelle calcium ca  chlorures cl  avec adjonction de gaz carbonique sodium la  sulfates s  natuurlijk mineraalvatermettoegevoegdkooliuurgas magnesiummg  luonures  lichtbruisend mineralisationanalyse mall potassium k  slice  residu sec droogrestc mglph  bicarbonates hc  aconsommerde preference avant a date indiqueesur abouteile teverbruiken otaefes bewaren source bato sa me ,Beverages,Waters and flavored waters
3068320011820,eau minerale naturelle avec calcium ca adjonction de gaz carbonique sodium na natuurlijk mineraalwater met toegevoegd koolzuurgas lichtbruisend mineralisationmagnesium mg samenstelling mgl residu sec a droogrest bij c mgl ph  chlorures ci   sulfates s    fluorures f  potassium k bicarbonates hco  silice si  a consommer de preference avant la date indiquee sur la bouteilleten minste houdbaar tot zie fles a stocker a labri du soleil dans un endroit propre sec et temperedroog fris rein en uit de zon bewaren source badoit bron saeme  saint galmier fr produit en france distribution ch evianvolvic suisse sa leutschenbachstrasse  ch zurich tel     distribution benelux ndanone waters benetux sa quai des usines werkhuizenkaai   brussels cpcc  illante cl ,Beverages,Waters and flavored waters
3068320014067,source cachat saeme  evian france ch evian volvic suisse tel     nectc eviancom pet sim  ch    ,Beverages,Waters and flavored waters
3068320014067,mineralisation totale mg calcium ca magnesium mg sodium na potassium k silice sio  bicarbonates hco   sulfates s  chlorures ci   nitrates no   teneur totaile en sels minerauxa c  mglph source cachat  saeme  evian france info consommateursfr     service et appel gratuits danoneaunaturelcom saeme bp   evian a consommer de preference avant la date ndiquee sur la bouteille a garder a labri du soleil dans un endroit propre sec et tempere pieces detacha ne pas laisser ce bouchon a la portee dun enfant de moins de  mois sans la surveillance dun adulte ,Beverages,Waters and flavored waters
3068320014067,eau minerale naturelle cl ,Beverages,Waters and flavored waters
3068320014067,source cachat saeme  evian france ch evian volvic suisse tel     f pet eviancom l h  wis ,Beverages,Waters and flavored waters
3068320014067,mineralisation totale gesamtmineralisation mglitre calcium cat magnesium mg  sulfates s sodium na potassium k silice sio  bicarbonates hco      chlorures c  nitrates no  teneur totale en sels mineraux a abdampfruckstand cmglph a consommer de preference avant la date indiquee sur la bouteille a garder a labri du soleil dans un endroit propre sec et tempere mindestens haltbar bis siehe flaschen aufdruck vor sonnenlicht geschutzt trocken kuhl und sauber lagern cl ,Beverages,Waters and flavored waters
3068320014067,evian auminerale naturel ch mineralwasser ,Beverages,Waters and flavored waters
3068320014067,evian eau minerale naturelle cl ,Beverages,Waters and flavored waters
3068320014067,q evian minerale naturelle iral mineral  cl i ca cine cas one ,Beverages,Waters and flavored waters
3068320014067,pe ee bp  tdate alel dans ms phables entant de abulte evian eau minerale naturelle ,Beverages,Waters and flavored waters
3068320014067,mineralisation totalecompositionsamenstelling mgl calcur ca magne mg sodiu a potass n k slice sca sio  bicarbonates hco  sulfatessulphates so  chlorureschlorides c     nitrates noj  teneur totale en sels mineraux a dry residue  hoeveelheid minerale zouten bij c mgph  source cachat springbronsaeme  evian franceproduct of hance a consommer de preference avant la date indiquee sur la boutelle comserver a tabri du soleil dans un endroit propre sec et tempere este houdbaar tot zie fles droog fris rein en uit de zon beware none waters benelux sa quai des usines  brussels into gratis b l nl danone waters ukireland po box  london w gq helpline uk   iril   el  z ,Beverages,Waters and flavored waters
3068320014067,mineralisation totale gesamtmineralisation mglitre calcium ca magnesium mg  sulfates so sodium nat potassium k  bicarbonates hco   chlorures ci     nitrates no  silice sio teneur totale en sels mineraux a abdampfruckstand cmgl ph a consommer de preference avant la date indiquee sur la bouteille a garder a labri du soleil dans un endroit propre sec et tempere  mindestens haltbar bis siehe flaschenaufdruck vor sonnenlicht geschutzt trocken kuhl elle ct und sauber lagern sb ,Beverages,Waters and flavored waters
3068320014067,mineralisation totale gesamtmineralisation mglitre calcium ca  bicarbonates hco  magnesium mg  sulfates so  sodium na potassium k silice sio  chlorures cl  nitrates no   teneur totale en sels mineraux a abdampfruckstandcmglph a consommer de preference avant la date indiquee sur la bouteille a garder a labri du soleil dans un endroit propre sec et tempere mindestens haltbar bis siehe flaschen aufdruck vor sonnenlicht geschutzt trocken kuhl und sauber lagern cl ,Beverages,Waters and flavored waters
3068320099651,mineralisation totalesamenstelling mg calcium ca  magnesium mo  sodium na  potassium k  silice si  bicarbonates hco  sulfates s  chlorures ci  nitrates no  teneur totale en sels mineraux a  hoeveelheid minerale zouten bi c  mgph  source cachat bronsaeme  e irfo consommateurs fri     service et appel gratuits danoneaunaturelcom saeme bp  evan dwbue jcockkstraat b  bxl info benelux gratis b  l  nl os france sumerbeneluxdanonecom a consommer de preterence relle er ant la date indiquee sur la boutele a conserver a labri du solel a un endroit propre sec et tempere ten minste houdbaar tot esdroog fris rein en uit de zon bewaren  ,Beverages,Waters and flavored waters
3068320099651,jeudi au dela de mon cafe tldevian dans la journee ,Beverages,Waters and flavored waters
3068320099651,evian eau minerale naturelle natuurluk mineraalwater cl ,Beverages,Waters and flavored waters
3068320099651,evi an corm cpcl  fr be     ,Beverages,Waters and flavored waters
3068320099651,evian eau mineral naturelle cl ,Beverages,Waters and flavored waters
3068320099651,mineralisation totalesamenstelling mg calcium ca  magnesium mg  sodium na  potassium k  silice si  bicarbonates hco  sulfates so  chlorures cl  nitrates no  teneur totale en sels mineraux a hoeveelheid minerale zouten b c  mglph   source cachat bronsaeme  evian france rfo consommateurs fr    service et appel gratuts danoneaunaturelcom saeme bp  evian db rue jcockxstrat  b bxl info benelux gratis b  l  nl  sumerbeneluxdanonecoma consoimmer de preference rt la date indiquee sur la boutelle a conserver alabri du sole sun endroit propre sec et tempere ten minste houdbaar tot relle ter es droog fris rein en uit de zon bewaren  ,Beverages,Waters and flavored waters
3068320099651,cokin or all sikar  m nizies ni gld sura saeme f usnas lext evian ration de cenel aireniers herteat acasamr aaser van de adon ens marte mrmshe bpes eau minerale naturelle natuurlijk mineraalwater cl ,Beverages,Waters and flavored waters
3068320099651,as evian eau m minerale naturelle natuurlur mineral wa ,Beverages,Waters and flavored waters
3068320099651,mineralisation totale  samens elling mg calcium ca  magnesium m  sodium na  potassium k  s ce sid  bicarbonates hco  sulf es s  chlorures ci  nitrates no eneur totale en sels mineraux a hoeveelheid mrale zouten bij c  mglph  source cachat bronsaeme   evian france no consommateurs fri    s ceetappelgatus anoneaunaturelcom saeme bp   evan dwg jcockxstraat  b bxl info ben a ux gratis   l  nl  consumerbeneluxdanonecoma consom ner de preference avant la date indiquee sur la bouteile a consenver a aoni du solel dans un endroit propre sec et tempere ten minste houdbaartot le cl ze fies droog fris rein en ut de zon bewaren ,Beverages,Waters and flavored waters
3068320099651,evian eau minerale naturelle natuurluk mineraalwater cl ,Beverages,Waters and flavored waters
3068320099606,boulettes de viande cuite surgelees recette suedoise preparatio surgelee de viande cuites de et de por ro es utes ele poids net  g   boulettes environ ,Fish Meat Eggs,Meat
3068320099606,cs       appel noll wwwpicardfr ingredients viande bovine origine france  viande de porc origine allemagne  eau chapelure farine de ble gluten sel levure oignon preparation a base dceuf liquide pasteurisee blancdeuf liquide ceuf entier liquide sel gras de porc amidon de pomme de terre sel poivre extrait de poivre issue danimaux nes eleves abattus en france  issue danimaux nes eleves et abattus en allemagne produit elabore en suede code article   se  ,Fish Meat Eggs,Meat
3068320099743,ac tri   krijk  serviceappel danoneaunaturelcom gratuits saeme bp   evian l consumerbeneluxdanonecom  ante ,Beverages,Waters and flavored waters
3068320099743, ource aint ce au er badoit finement pe t petillante ,Beverages,Waters and flavored waters
3068320099743, saint galr finement petillante ur bado ,Beverages,Waters and flavored waters
3068320099743, saint doit ts ement petillan ,Beverages,Waters and flavored waters
3068320099613,eau minerale naturelle avec calcium ca adjonction de gaz carbonique  sodium na natuurlijk mineraalwater met toegevoegd koolzuurgas lichtbruisend mineralisationmagnesium mg  chlorures cit   sulfates s   fluorures f  bicarbonates hco  silice si  samenstelling mgu residu sec a potassium k droogrest bij c mgl ph consommer de preference avant la date indiquee sur la bouteille ten minste houdbaar tot zie fles a stocker a labri du soleil dans un endroit propre sec et tempere droog fris rein en uit de zon bewaren source badoit bron saeme  saint galmier fr produit en france distribution ch evianvolvic suisse sa leutschenbachstrasse  ch zurich tel     distribution benelux nv danone waters benelux sa quai des usineswerkhuizenkaai   brussels  llante cl ,Beverages,Waters and flavored waters
3068320099613, sour saunt galamer badoit finement petillante ac ,Beverages,Waters and flavored waters
3068320099613, pense sant galmier sour ce sadoit finement petillante chiara ferragn c ,Beverages,Waters and flavored waters
3068320099613,eau minerale naturelle avec calcium ca adjonction de gaz carbonique  sodium na natuurlijk mineraalwater met toegevoegd koolzuurgas lichtbruisend mineralisationmagnesium mg  chlorures cit  sulfates so   fluorures f  icarbonates hco  silice si  potassium k samenstelling imgl residu sec a droogrest bij c  mgl ph a consommer de preference avant la date indiquee sur la bouteille  ten minste houdbaar tot zie fles a stocker a labri du soleil dans un endroit propre sec et tempere droog fris rein en uit de zon bewaren source badoit bron saeme  saint galmier fr produit en france distribution ch evianvolvic suisse sa leutschenbachstrasse  ch zurich tel     distribution benelux nv danone waters benelux sa quai des usineswerkhuizenkaai   brussels o mies 이it ipetllante cl ,Beverages,Waters and flavored waters
3068320099613, saint galn badoit finement petillante x w chiara ferragn c ,Beverages,Waters and flavored waters
3068320099613,  im   source saint galmia badoit finement petillante ,Beverages,Waters and flavored waters
3068320099613,naturelle calcium ca  chlorures cl egazcarbonique sodium na  sulfates so  mgl magnesium mg  fluonuresf  c  mql potassium k  silice sio bicarbonateshc e preference avant la date indiquee sur la bouteille abri du soleil dans un endroit propre sec et tempere saeme  saint galmier france ,Beverages,Waters and flavored waters
3068320099613,noa regions la gastrono badoit i finement petillante ,Beverages,Waters and flavored waters
