barcode,clean_text,pnns_groups_1,pnns_groups_2
3191220008185,donnaes nutritionnelles pour g kj kcal matiare grasse   g dont acides gras saturasg gluci des g dont sucres g fibres g prota ines g es ur sel  g a consommer de prafarence avant le  nalot j ,Fruits and vegetables,Dried fruits
3191220004989,na nas brou vergez sse  uot n dananas seches fruites et gourmands prepares a partir dananas des morcea selectionneses decoupes en morceaux pour etre ensuite sucres et deshydrates alar chaud ananas deshydrateingredients ananas sucre acidifiant e conservateur e contient des sulfie apres ouverture conserver au refrigerateur et consommer rapidement a consommer de preference avarta date figurant sur lemballage matiere premiere importee traces eventuelles de fruits a coques fabrioue an francegetrocknete ananas zutaten ananas zucker sauerungsmittel e konservierungsmittet  sulfite enthalten nach aam offnen im kuhlschrank aufbewahren und zugig aufbrauchen mindestens halder bis siehe verpackung urs rungsland import kann spuren von nussenenthalten hergestelt in fanireich dehydrated pineapple ingredients pineapple sugar acidity regulatore  preservative e contains sulfite after openingkeep efrigerated and consume quickly best used defore date on packaging imported ingredients may contain traces of nuts produced in france brousse vergez rue rabelais marseillewwwbroussevergezcom valeurs nutritionnelles moyennes durchschnittliche nahrwerte average nutrition values poids net nettogewicht net weight fra cerge brennwert energy  kj  kcal iere grasee ifett fat g es gras satures  davon gesattigte reuisaurenlof which saburated fat  g  g gluoideskohlenhydratel carbohydrate g dont sucreldawon zuckerlof which sugar  g proeines eiwel proteins  tballaststoffefiber g sel salzsalt g pensez au tri roe alla saghet arecycler consigne pouvant varier localement wwwconsignesdetrifr pourdaper  g dans la gamme brousse vergez papaye le gingenn follo cocktail thai etfr ,Fruits and vegetables,Dried fruits
3191220000035,duna dattes deglet nour poids net g lot n  cat a consommer de preference avant le  origine tunisie importe par brousse vergezrue rabelais  marseilleemb h ,Fruits and vegetables,Dried fruits
3191220000035,dattes deglet nour ingedents dates srop degucoseconservateure poids net g lot n  cat aconsommer de preference avant le  origine tunisie mporte par brousse vergez rue rabelais  marseille emb h caf  beni khaled tun ,Fruits and vegetables,Dried fruits
3191220004958,un delicieuxtmunt mes sechees sont preper bupees en tranches puis sucrees et deshydratees a lair chaud al aux multiples bienfas nutritionnels nos trenches a partir de mangues selectionnees mures a pot ngue dratee ingredients mangue sucre jus de mangues acidifiant e conservateur e co apres ouverture conserver au refrigerateur et consommer racdement a consommer de prile antuelles de fruits a coques fab ung zugig aufbrauchen mindesten deshy ile figurant sur allage matiere premiere importee tracess crtrocknete  zutaten mango zucker mango safterungsmitel e konservien enth lte nach dem offnen im kuhlschrank aufbewah packung kann spuren von nussen enthalten urs date m sland import hergestellt in fr hydtauoragoeingredients mango sugar mango juice acidity regulator e preservative e comntaie ra paingkeep refrigerated and consume quickly best used before date on packing imported ingede ay t aes of nus produced in france brousse  rue rabelais  marsellewwwbroussevargezcom ,Fruits and vegetables,Dried fruits
3191220000813,valeurs nutritionnelles pour  g nutritiona facts for  g energieenergy  kj   kcal matiere grassefat g dont acides gras satureslo fwhich saturated fat g glucides carbohydrate  g dont sucres of which sugar   g proteines proteins   g selsait  g ,Fruits and vegetables,Dried fruits
3191220000813,ingredients raisins secs adjuvant huile vegetale huile de graine de coton a conserver de preference dans un endroit frais et sec apres ouverture conserver au refrigerateur a consommer de preference avant la date figurant sur retiquette fabrique en turquie ingredients raisins adjuvant vegetable oil cottonseed oil keep preferably in a cool and dry store after opening keep refrigerated best used before date on packaging produce of turkey scanne au laser et detecteur de metal laser scanned and metal detector brousse vergez rue rabelais  marseille emb  f ,Fruits and vegetables,Dried fruits
3191220009830,brou source denergie nergiereich con nour dattes denoyautees moelleuses softdatteln entsteint wwwbrousse vergez can ,Fruits and vegetables,Dried fruits
3191220006327,broy vergezsse dattes dattes ,Fruits and vegetables,Dried fruits
3191220009007,prestige abricots au sirop leger ,Fruits and vegetables,Fruits
3191220009007,oz occiolato  oz s abricots peles eau sucre acidifiant e r rapidement aconsommer de preference avant la ,Fruits and vegetables,Fruits
3191220001391,brover caviar de tomates confites uren a recetc francaibe ,Fat and sauces,Dressings and sauces
3191220001421,over bro morceaux de thonl e thon listao au naturel la difference wwwbroverfr ,Fish Meat Eggs,Fish and seafood
3191220001421,s brover morceaux de thon listao au naturel ingredients thon katsuwonus pelamisl eau sel apres ouverture conserver au refrigerateur et consommer rapidement a consommer de preference avant la date figurant sur le couvercle fabrique a rice skipjack tuna chunks in brine ingredients tuna katsuvonus pela watersalt after opening keep refrigerated and consume quickly best used re date on lid produced in mauritius trozos de atun barrilete al natural redientes atun katsuwonus pelamis aqua sal una vez abierto mantener gerado y consumir rapidamente consumir preferentemente ames la fecha ada en la tapa fabricado en isla mauricio pezzi di tonno al naturale redienti tonno katsuwonus pelamis acqua sale dopo lapertura conservare trigorifero e consumare a breve termine da consumarsi preferibilmente entro eata indicata sul coperchio prodotto in mauritius thunfisch stucke natur utaten thunfisch katsuwonus pelamis wassersalz nach de offnen im kuhlschrank aufbewahren und zugig aufbrauchen mindestens haltbar bis siehe bodendeckel hergestellt in mauritius tonijn stukken in water ingredienten mor tonijn katsuwonus pelamis water zout na opening gekoeld bewaren en snel valeurs nutritionnellesnutrition facts valores nettogewichtnetto gewicht vertiruiken tenminste houdbaar tot einde zie deksel vervaardigd in mauritius poids netnet weight peso netopeso netto nutricionalesvalori nutrizionali  nahrwerte matiere grassefatgrasagrassifett net gesatigte fettsaurenwaarvan verzadigde vet  g  oz voedingswaarde energieenergyenergiabrennwert  kj kcal  g  g  g g  g dant acides gras saturesof which saturated fat de los cuales saturadasdi cui saturidavon peso escurrido netto sgocciolat nettoabfiopgемс netto uitlekgewicht net egouttenet drained glucidescarbohydratecarbohydratos carboidratikohlenhydratekoolhydraten dont sucreof which sugarde los cuales azucar a zucheraldavon zuckerwaarvan suiker  g  az proteinesproteinsproteinalproteine elweilelwitten saltsalsalesalzzout n agrement dvsitf g pourforparaperje  g verger ,Fish Meat Eggs,Fish and seafood
3191220005016,bfou ergysse ergez fraises fraises  g ntieres ses deshydrate  ooo ,Fruits and vegetables,Dried fruits
3191220005016,fraises deshydratees raises s e colorant e  effets indesirables sur avoir des enfants acidifiant e cor apres ouverture conserver ent des sulfites au rapidement a non reference avant la date figurant sur mballage abrique en zucker konservieru auf die mai ha en einen negative aktivitat und kindern sauerungsmittel nac dem offnen im kuhlschrank aufbewahren und zugig uchen mindestens strawberries yngredients dehydrated strawberries preservatives i  colorant e in have an adverse effect on acidifier e contains sulfite al ter refrigerated and consume best used before date on packing in france vergez  rue rabelais  marseille valeurs moyennes nutritonnelles energie average values brennwertlenergy  kj kcal dontacides grasse fat  g gras satures which saturatedfat g glucideskohlenhydratel carbohydrate g zuckerlof sugar  proteinesl eineibwproteins g sel salz lsalt  g pourijelper  g poids net nettogewich     g  lot bv f ,Fruits and vegetables,Dried fruits
3191220009823,bio orou vergezsse soft moelleux nos dattes moelleuses deglet nour issues de lagriculture biologique nont subi aucun ajout de glucose ni dautres conservateurs leur caractere   naturel preservant ainsi toute la finesse de leur subtil arome de miel la deglet nour est la varete de dattes la plus aporeciee pour sa qualite supeneure et ses bienfajts nutritionnels les dates brousse vergez sont denoyautees a la main une par une avec le plus grand soin unsere deglet nour datteln stammen aus rein biologischer landwirtschaft konservierungsmitteln aus und bewahren dadurch ihr feines aroma deglet nour ist die auf grund ihrer hohen qualitat und ihrer emahrungsphysiologischen vorteile beliebleste datlelsorte dattes denoyautees rehydratees a   dhumidite maximum et pasteurisees ingredient dattes biologiques a conserver dans un endroi frais et sec apres ouverture conserver au refrigerateur et consommer rapidement a consommer de preference avant la date figurant sur le sachet dattes tunisie emballe en turquie getrocknete und entsteinte pasteurisierte datteln zuaen bio datten kann trotz sorgfatiger entsteinung steine oder steinreste enthalten biue vor und nach dem offnen kuhl und trocken lagen nach den offnen innermalb weniger tage verbrauchen mindestens haltbar bis siehe unten datteln tunesien verpat n oer turkei pitted dates rehydrated to  maximum moisture and pasteurized ingredient organic dates keep in a cool and dry store after opening keep rengrin kommen ganzlich ohne zugabe von and consume quickly best used before date on bag dales tunisia paccked in turkey brousse vergez rue rabelais marseillefranceems valeurs nutritionnelles moyennes durchschnittliche nahrwerte average nutrition values poids net nettogewicht net we gnt pensez au trit  g baghet clr energiebrennwertenergy  kj  kcal consigne pouvant varier localement wwwconsignesdetrifr matiere grassefett fat g dont acides gras saturesidavon gesattigte fettsaurenof which saturated fat g  lot   ir bio ideskohlenhydratecarbohydrate g nar g ution ,Fruits and vegetables,Dried fruits
3191220009823,brou verge sse ource denergie energiereich tat gen deglet nour dattes denoyautees moelleuses biosoftbatteln entsteint wwwbrousse vergez com ,Fruits and vegetables,Dried fruits
3191220004262,cornichons au vinaigre cornichon  lsnhoients qui font la difference wwwbroverfr boase ,Fruits and vegetables,Vegetables
3191220004262,valeurs nutritionnelles  nutrition facts valores nutricionales valori nutrizionali  nahrwerte voedingswaarde energieenergyenergiabrennwert  kcal  kj g g  g  g watiere grassefatgrasagrassifett vet dont acides gras saturesof which saturated fau de los cuales saturadasdi cui saturidavon gesattigte fettsaurenwaarvan verzadigde vet glucidescarbohydratecarbohydratos carboidratikohlenhydratekoolhydraten dont sucreof which sugarde los cuales azucar di cui zuccherodavon zuckerwaarvan suiker proteinesproteinsproteinaproteinel elweißeiwitten  g  g selsaltsalsalesalzzout  ,Fruits and vegetables,Vegetables
3191220004262,cornichons pasteurises au vinaigre ingredients cornichons eau vinaigre se oignons affermissant  e  graines de moutarde poivre coriandre arome natre destragon apres ouverture conserver au refrigerateur et consommer rapidement a consommer de preference avant la date figurant sur le couvercle fabrique en inde pasteurised gherkins in vinegar ingredients gherkins water vinegar sal onion fiming agent e mustard seed pepper after opening keep refrigerated and consume quickly best used before date on litdk produced in thdia pepinillos pasteuri cebolla coriander natural tarragon aroi neninillos agua vinagre sal aroma natural cansumir ,Fruits and vegetables,Vegetables
3191220009335,chaeree g  u r mp e t oreillons dabricot au sirop ,Fruits and vegetables,Fruits
3191220009335,oreillons dabricots au sirop apricot halves in syrup mitades de albaricoques en almibar ingredientsoreillons dabricotseausucre ingredients apricot halveswater sugar ingredientesmitades de albaricoques agua azucar  g  g  poids net net weight peso neto poids net egoutte drained weight peso neto escurrido a consommer de preference avant la date figurant sur le couvercle consumir preferentemente antes del ver la tapa best beforesee the lid produit de grece product of greece producto de grecia brousse vergez emb  f  rue rabelais  marseille challenge gourmet ,Fruits and vegetables,Fruits
3191220006334,pate de dattes dalgerie elbaraka tolga eldaraka ,Fruits and vegetables,Fruits
3191220006334,de daite ingredients dattes  ,Fruits and vegetables,Fruits
3191220006952,brou vergezsse deglet nour branchees  kg poids net ,Fruits and vegetables,Dried fruits
3191220006952,dattes branchees deglet nou dalgerie poids net kg aconsomnmer de preference vantie n de lot  ,Fruits and vegetables,Dried fruits
3191220006341,ail hotho c  vergez s sse ananas deshycrate ananas sucre acidifiant e conservateur e noix de coco deshydratee nok de co don de ble sirop de glucosefructose sucre dextrose gelatine bovine sel papaye deshydratee papaye scoe c yocknete ananas ananas zuckerstur n un melange gourmand de saveurs exotiques  ananas coco papayes et mangues lear ez mangee deshydrate mangue sucre acidifiant contient des sulfites apres ouverture cm relrigerateur et constmmer rapidement a consommer de prece avant la date figurant sur lemballage madere peinire more traces evertuelles de fruits a coques fabrique en france rea ka tosesirup zuckerdextrose gelatine aus rind salz getrocknete pap a papaya zucker konservienungemite getrocknete mangomango zucker sauerungsmittel e sulfite enthalten nach dem offnen im kuhlschranka hren und zigig auitrauchen mindestens haltbar bis siehe verpachung ursprungsland import kann spuren van iion  gluic nsenvierungsmittel e getrocknete kokosnuss aten kokosnuss weizenstarke enthalan herges all in fankreich dehydrated pineapple pineapple sugar acidity regulator e persenate e detydrated coconus ingredients coconut wheat starch glucosefructose syrup sugar dextrose beef golalin ot lilitp drauied papaya pagaya sugar preservative e dehydrated mango mango sugar acidity regulator exo cntr sulte ater opening keap refrigerated and consume quickly best used before date on packaging imported ingrdir contain traces of nus produced in france brousse vergez rue rabe is marsellewwwbroussw aleurs nritionnelles moyennes ourchscanittiche nahrwerte average nutrition values poids net nettogewicht net weight fenped brenin wert energy  kj  kcal fonmt acicles quras satures  davon gesattigte  g mablere grassefett fat  g festaluren of which saturated fat g desy kohlenhhydratel carbo aireldlavon zucker prodeines w arscycler sgnepouvant rerlo esdetrifr nor ,Fruits and vegetables,Dried fruits
3191220001704,brover br eri peches au sirop leger demi pechs denoyautees par torsion patisserie les ingredients francaise ,Fruits and vegetables,Fruits
3191220000400,broy sse vergez abricots ,Fruits and vegetables,Dried fruits
3191220000400,abricots secs abricots secs ingredients abricots conservateur dioxyde de soufre sulfite a conserver de preference dans un endroit frais et sec apres ouverture conserver au refrigerateur a consommer de preference avant la date figurant sur lemballage produit en turquie getrocknete aprikosen zutaten aprikosen konservierungsmittel sulfite kuehl und trocken lagern nach dem offnen im kuhlschrank aufbewahren mindestens haltbar bis siehe pack ursrungsland turkei dried apricots ingredient apricots preservative sulfur dioxide sulfite keep preferably in a cool and dry store after opening keep refrigerated best used before date on packaging produce of turkey albaricoques secos ingredientes albaricoques conservante dioxido de azufre sulfito conservar de preferencia en un lugar fresco y seco una vez abierto mantener refrigerado consumir preferentemente antes de la fecha indicada sobre el paquete producto de turquia gedroogde abrikozen ingredient abrikozen conserveermiddel zwaveldioxide sulfiet koel bewaren na opening gekoeld bewaren tenminste oudbaar tot sie verpakking product van turkije brousse vergez   rue rabelais  marseille schwefeldioxid ww ssevergezcom erte nutrition facts  aarde ,Fruits and vegetables,Dried fruits
3197000211172,le radis noir conservation ians le refrigerateu envelopper le radis dans un papier absorbant humidifie les plaisirs de la terre atlantic tout frais vit pret smb  ,Fruits and vegetables,Vegetables
3197000211172,fruts et legumes frais les ateliers fraiche radis noir oaoler atlantic tout frais vitpret wwwmaraisfr  marais  les sorinieres pe ,Fruits and vegetables,Vegetables
3197000211172,le radis noir conservation  dans le refrigerate envelopper le radis dans un pape absorbant humidifie les plaisirs de la terre atlantic tout frais vit pret  e ,Fruits and vegetables,Vegetables
3197000450427,les plaisirs de la terre atlantic mache origine france pays de loire  marais poids net g www marais fr trier et passer leau claire avant emploi ,Fruits and vegetables,Vegetables
3197000455149, fruity et legumes frais les ateliers fraicheur atlantic tout frais vitpret mache  poids net  g  mache origine france    rincez et cest pret producteur emballeur fabrique en france wwwmaraisfr groupe marais  bp  les sorinieres tel   emb e f ,Fruits and vegetables,Vegetables
3197000455149,fruity et legumes frais les ateliers fraicheur atlantic tout frais vitpret mache x poids net g  mache origine france ,Fruits and vegetables,Vegetables
3197000455149, fruity et legumes frais les ateliers fraicheur atlantic tout frais vitpret mache  poids net   mache origine france    rincez et cest pret producteur emballeur fabrique en france wwwmaraisfr groupe marais  bp  les sorinieres tel    emb e ,Fruits and vegetables,Vegetables
3197000453169,les ateliers fraicheur atlantic tut frais vitpret producteur  emballeur topinambour poids netg topinambour igine france l avec sarcette  i  emballe manuellement en pays de la loire lesateliersfraicheurfr mache scannez pour obtenir toutes noy informations et nos recettes o rincer a leau claire avant emplol a conserver de preference dans le bac de votre refrigerateur f wwwmaraisfr entreprise famnidiale fondee en  marais nantesbp  les sorinieres tel  emb e ,Fruits and vegetables,Vegetables
3197000453169,topinambour poids net g topinambour scerance l   ,Fruits and vegetables,Vegetables
3197000440053,fruity et legumes frais les ateliers fraicheur marais tout frais vitpret tomate grappe poids net  kg ref n  omate non calibre cat i rigine france g    fabrique en france rincez et cest pret lart de cultiver a la francaise producteur emballeur wwwmaraisfr wwwtomatemaraisfr groupe maraisbp  les sorinieres tel  emb e ,Fruits and vegetables,Vegetables
3197000440053,frulse tegumes fraus les ateliers fraicheur marais tout frais vitpret tomate grappe poids net  kg ref n omate non calibre cat i rigine france g    fabrique en france rincez et cest pret lart de cultiver a la francaise producteur emballeur wwwmaraisfr wwwtomatemaraisfr groupe marais  bp    les sorinieres tel   emb e f ,Fruits and vegetables,Vegetables
3197000514198, o c ic r e c  oo  groupe marais bp  les sorinieres tel   emb f rincez et cest pret producteur emballeur wwwmaraisfr certifi e f ab agricolture agricuyure france ologirue certifi parfrdioo ,Fruits and vegetables,Vegetables
3193600004213,huile de noir compagnie saveurs ,Fat and sauces,Fats
3191010083309,valeurs nutritionnelles moyennes pour   ml sport nan diae average nutritional value for energie energy matieres grassesfat dont acides gras satures  of which satured fat glucidescarbohydrates dont sucresof which sugar fibres alimentaires dietary fiber proteinesproteins selsalt produot sport not dluted with water  kj kcal traces g  g  g g g traces ,Beverages,Sweetened beverages
3191010083309,sirop spon citro lenergie au ceur du fruit aromes naturels ircfora ,Beverages,Sweetened beverages
3191010083309,ingredients sucre eau jus de citron a base de concentre  acidifiant acide citrique aromes naturels dagrumes extrait naturel dagrumes emulsifiant e ,Beverages,Sweetened beverages
3191010083309,chdrdc sumers  imgle and authentic moment of refreshing leare coor  ution volume de sirop sport additionne de  a umes de aconserver au frais apres ouverturea consommer de preferenceaunt fin voirbuthon after opening keep the bottle in chilled area best before e seeon teap use volume of sirop sport for  to  volumes ater inaredients sucre eau jus de citron a base de concentre  acidifiant acide citrique aromes naturels concentrated juice  aodhing ingredients sugar walt emon jice m c agrumes extrait naturel dagrumes emulsifiant e natural flavours citrus naturalerat iatin gite  ar aor aport de sinp por t an average adut apor cotdire  alp dr day elerare  clrr ml sport nondiae  ml spor valeur mubrtioneles mayennes pour m sport nat futet with wat sport hited wih watrdri ren  kj  kcal  kj kcal averapenurtinalvalue for energieenergy matieres grassesfat dont acides gras satures of which satured fat glucldescarbohydrates dont sucresof which supar fbres alimentairesdietary fiber proteinesproteins sel sait product of france traces og traces og g g    og og traces traces bardnet  cl  berauhn thl  emb a    ro oo g ogc f cd ,Beverages,Sweetened beverages
3191010083309,sirop sport citror lenergie au coeur du fruit aromes naturels sans coloran ,Beverages,Sweetened beverages
3191010083309,after opening keep the bottle in chilled areab ingrealients sucre eau jus de citron a base de ingredient concentre  acidifiant acide citrique aromes naturels concentra dagrumes extrait naturel dagrumes emulsifiant e naturalfa ml s l ml sort ma क ea ,Beverages,Sweetened beverages
3191010083309,esirop le savoirfaire etle soud la sportdepuis de succis la vous le de sport apporte plus  sinop rafra ans les dune authentique wellrenowned ple sensations un plaisir et been over years sport distinctive for  sirop those knowhow and quality our p characteristics guarantee will refreshing moment of and decitron sirop deau  volumes boudian op consommerde preference water the cap are ktumes of see ed best end ve concentrated juice acdtyng pes natural pour un at reference dri    kca dri da traces traces ,Beverages,Sweetened beverages
3191010083309,sirop sport citror lenergie au cceur du fruit aromes naturels sans colorant ,Beverages,Sweetened beverages
3191010083309,sirop sport citror lenergie au cceur du fruit brete  e น อสล o มจ คงณนพก aromes naturels sans colorant ,Beverages,Sweetened beverages
3191010083309,and duden ro sirop dec leons utilisation volume de sirop sport additionne de  a  volumes d aconserver au frais apres ouverturea consommer de preference avant finwir outn use volume of sirop sport for  to  volumes of water after opening keep the bottle in chilled areabest before end seeon the cp dents sucre eau jus de citron a base de ingredients sugar water lemon juce ae cocentre  acidifiant acide citrique aromes naturels concentrated juice  acidfying ctc at faomes extrait naturel dagrumes emulsifiant e talers urtionels moyennes pour  ml sport non dle  ml sport natural flavours citrus nahural extract emulfing aoraoiraot reffernce pour un sport not huted wih water sport teww  kj kcal  kj kcal dr  aueage nubrtional value for energlieenergy matieres grassesfat comt acides gras satures which satured fat bluidescarfohydrates tont sucresof which sugar flores alimentaires dietary fiber proteinesproteins sall saft product of france  kj ga de sirng sport aile dr day referem an average adut   kcal r lni traces g traces o g  g  g g g g og races symup spornt og traces bardnet domaine de re  cl emb a   o keol  o ,Beverages,Sweetened beverages
3191010083309,bsirop aucoeur du fruit energie citror aro mes naturels sans colorant ,Beverages,Sweetened beverages
3191010083309,aer ope ingredients sucre eau jus de citron a base de concentre  acidifiant acide citrique aromes naturels dagrumes extrait naturel dagrumes emulsifiant e ,Beverages,Sweetened beverages
3191010083309,hsirop sport au cœur dufruit lenergie citror r డయ aromes naturels sans colorant ,Beverages,Sweetened beverages
3191010083309,aurel dagrumes emulsifiant e natural flavours citrus natu  dri outiomells moyennes pour  ml sport mon dilue  ml sport diue  aqr  spurt iot iluted with water sport filuted with water   kj kcal  kj kcal    herage nutritional value for energieenergy matieres grassesfat omtacdes gras satures df which satured fat cucidescarbohydrates  traces o g traces g   g  g nt sucres of which sugar tures alimentairesdietary fiber proteinesproteins sel  salt   g g g traces  product of france traces  ,Beverages,Sweetened beverages
